id,word,dialect,definitionEnglish,definitionNative,pos,domain,subdomain,exampleSentence1,exampleSentence1English,exampleSentence2,exampleSentence2English,additionalSentences,relatedWords,nounClass,verbExtensions,tamMarkers,register,audience,sourceType,provenance,copyright,dateCreated,createdBy
kdks3s4y8,kwebembera,Rutooro,leadership,kunanata,N,NAR,NAR-HIS,obwebembezi oburungi buletaho enkurakurana,"good leadership brings development. ",obwebembezi bubi bulemesa enkurakurana  hakyaro.,"bad leadership can fail the village to develop. ",[],,7,[],[],general,general,original_composition,,Project_License,2026-02-17 21:34:30.307+00,7ldvwi8jh
kewxsejyu,Enseegu,Mixed,A small calabash dried with its seeds that make araltling sound. The trod healers use it to commonly crowd rattle,"Akasisi komukono guterekenire, koomerwemu empambo obubakakyayo zigamba, abatumu bakakozesa muno ",N,ART,,"Omutumu wa'nseeri,araire naterera enseegu",The with doctor beyond played the gourd rattles last night,Enseegu no' mukukali baziteerra,The gourd rattles are also played in the palace,[],,,[],[],general,general,original_composition,,Project_License,2026-02-21 15:14:08.056+00,z7cmq5grs
kfto5jkjp,Kusesa amahasa,Mixed,The ceremony joining the two families of mother and father of the twins to eat together and cerebrate the birth of twins.,okuterana kwa obowaabu nyinabarongo na isabarongo muka emu habwokuliira hamu nokusiima rubanga.,V,ART,,Hakiro kyokutaha baketweeka oburo buhiire babutwaara owaabu isabarongo.,The family of the twin mother carried cooked food to the twin father's family.,Akeemera ayetwekere oburo kuhikya nyakatagara obuyarugire omunju kubumutuura.,He couldn't put down the basket of millet from his head until the priestess came  out of the house to receive the basket.,[],,,[],[],general,general,original_composition,,Project_License,2026-02-20 15:02:41.655+00,z7cmq5grs
kh3nw2z3z,kwehayo,Mixed,To be committed,kwehongayo,V,NAR,NAR-PER,omukazi akehayo naage goona kuserurra abekaye ekibaralya,"The woman tried and very committed to look for what her family will eat. ",n'omusaija atabyame akehayo kugenda kuserra omukubi,even the man didn't sleep was committed to go and look for the source.,[],"kuhayo, kwefereza, kucwamu",,"[""V-CAUS""]",[],general,general,original_composition,,Project_License,2026-02-17 18:55:27.35+00,7ldvwi8jh
kjunn0ijl,Abazirija,Rutooro,,,N,,,,,,,[],,,[],[],general,general,original_composition,,Project_License,2026-02-18 14:00:32.505+00,ruom6sfi4
klna8jlw1,MUCUNGUZI,Mixed,,,ADJ,SPR,,,,,,[],"RUHANGA,",,[],[],general,general,original_composition,,Project_License,2026-02-23 09:07:13.562+00,ruom6sfi4
klvwdgp3g,HATI,Mixed,,,N,SPR,,,,,,[],BUNU- BUNU,,[],[],general,general,original_composition,,Project_License,2026-02-24 06:46:45.222+00,ruom6sfi4
kp9ici2wd,Ekihuro ky'oburo,Mixed,Traditional Meal,"Oburo
Millet bread",N,CUL,CUL-FOO,"Ekihuro kyenzaarwa  ekikuru nubw'oburo, bwine kuba hamukoro gwona ogwenzaarwa, nkahakweranga habaho ekihuro kyomuko ekikuru Oburo n'esabwe.",The most traditional meal is millet bread this must be on all traditional ceremonies like at introduction always that special meal for son in- law millet bread and traditional source.,"Oburo butekanizibwa ohonda,okaranga, osegesa,osa, okekeya, ohotora nukwo oihura.","The millet preparation as follows: pounding, frying, winnowing, grinding, sieving, mingling and serve. ",[],Ekihuro kyekitinisa.,,[],[],general,general,original_composition,,Project_License,2026-02-21 07:07:27.092+00,7ldvwi8jh
kqkwhrs6q,Kuheheera,Mixed,Singing with a good tone.,Kuzina n'iraka erirungi,V,,,"Leka Kukarra muka zina, noheheera.",Please sing the song with a good tone.,"Okwotarukuheherra, ekizina n'okisiisa.",The melody will be spoiled if you don't sing agood tone.,[],,,[],[],general,general,original_composition,,Project_License,2026-02-22 18:55:38.44+00,z7cmq5grs
kssjn0ako,Ekitontozi,Mixed,A toddler (Young child between 1 and 3 years old.),Ekitontozi (Atakahikize emyaka esatu yobukuru.),N,DLY,,Ekitontozi nikirumwa enjara.,The toddler is hungry.,Gabira ekitontozi eki.,Feed that toddler.,[],Entajuga,,[],[],general,general,original_composition,,Project_License,2026-02-21 09:48:56.303+00,1lzzop9e4
ksu6eivug,Abagahi,Rutooro,,,N,,,,,,,[],,,[],[],general,general,original_composition,,Project_License,2026-02-18 14:00:32.505+00,ruom6sfi4
ktvq7kblh,Ekizina,Mixed,music(composition designed to be performed by human beings by voice or instruments),"amaraka agatekanizibwe mu noota ezitarukusisana, ezikurataine nukwo zirugwemu iraka eryekizina ekirukusemeza arukuhurra.",N,ART,,Mpuliirege ekizina kirungi haradio.,I listened to a nice song on the radio.,Ekizina kyobukama kigira iraka lirungi.,The kingdom anthem of Tooro and Bunyoro have pleasant melodies.,[],"ebizina(bingi), songs(plural), kuzina(action), sing(perform)",,[],[],general,general,original_composition,,Project_License,2026-02-20 09:18:32.167+00,z7cmq5grs
kv936vyxc,Kutamarwa,Rutooro,,,N,,,,,,,[],,,[],[],general,general,original_composition,,Project_License,2026-02-19 13:46:10.493+00,7ldvwi8jh
kx8xqw50e,Emanzi,Mixed,Warrior,omurwani owamaani,N,DLY,,Akamerra nobumanzi bwingi yarwana yasingura obulemu.,The warrior fought and won the war.,Ogu murwani mali.,That one is real warrior.,[],omukwatira kunyunka,,[],[],general,general,original_composition,,Project_License,2026-02-21 20:51:30.651+00,1lzzop9e4
kyvwo51um,Amagezi,Mixed,"Wisdom ",,N,GOV,,Owamagezi nasobora kulema kurungi.,A wise person can be a good leader.,Owamagezi maingi asobora kulemwa kwebembera abadoma.,A wise person can fail to lead fools .,[],Intelligent,,[],[],general,general,original_composition,,Project_License,2026-02-22 09:57:09.461+00,wmqgng8ap
kzh8wixc5,OBUJUNE,Mixed,,,V,SPR,,,,,,[],"OKUBIHIRWA,",,[],[],general,general,original_composition,,Project_License,2026-02-24 06:18:54.929+00,ruom6sfi4
kzhzg4emf,Emizimu,Rutooro,Spirits,,N,,,,,,,[],,,[],[],general,general,original_composition,,Project_License,2026-02-23 08:56:25.838+00,7ldvwi8jh
l0bhl3wrv,Abatimbo,Rutooro,Royal Musicians whose music insights the king against danger,"Ebizina  bya Babatimbo bikengesa omukama akabi akali omumaiso ",N,,,"Omukama kawayera, Omuhimbo gwijwire omutima kandi kawayebwa omunyanzigwa naleetwa Kibaale.
","King, you are happy and full of Joy, have  you forgotten the enemy from the direction of Kibaale?","Abatimbo n'entimbo zaabo mbabo, barabaho"," Look, the Batimbo and their short drums are passing by.",[],"Banyimirwa, Bazini",2,[],[],general,general,original_composition,,Project_License,2026-02-17 10:01:21.414+00,ruom6sfi4
l1aaa5kat,Nsanyuse,Rutooro,,,N,CUL,CUL-FOO,,,,,[],,,[],[],general,general,original_composition,,Project_License,2026-02-21 15:38:29.055+00,7ldvwi8jh
l3q2o0yz0,Kudoodooka,Mixed,growing thin,,N,DLY,,,,,,[],,,[],[],general,general,original_composition,,Project_License,2026-02-23 11:22:39.605+00,1lzzop9e4
l3xgxovwx,kuzonzora,Rutooro,Discover,,V,,,,,,,[],,,[],[],general,general,original_composition,,Project_License,2026-02-23 07:24:48.266+00,7ldvwi8jh
l4rd8vn9a,bisunsa,Mixed,Edible leaves of pumpkin plant,,N,DLY,,,,,,[],,,[],[],general,general,original_composition,,Project_License,2026-02-23 13:42:20.288+00,1lzzop9e4
l4reonrpb,Ogwomungaro,Mixed,,,N,,,,,,,[],,,[],[],general,general,original_composition,,Project_License,2026-02-21 14:03:53.607+00,7ldvwi8jh
l89y6ioah,Kutendeka,Mixed,Train,To train a skill,V,EDU,,Kutendeka abeegi omu itendekero.,Training students in a collage/institution.,Abasahu batendekebwa,Doctors are trained.,[],"omukugu, kukuguka(well trained), omuginga(professor).",,[],[],general,general,original_composition,,Project_License,2026-02-18 10:02:09.758+00,wmqgng8ap
ldbiudw35,Kwookya ebikoomi,Mixed,setting sire on weeds and grass after preparing land.,okwaakya ebinyansi ebyooba olimire mumusiri.,V,ENV,,"Ebinyansi byoona akabyokya, ebyokulya tibyaija kurungi.",She burnt all the grass after digging and her garden lost fertility.,Owomuruka akataho omusomo gw'okutanga abantu kwookya ebinyansi ebyolimire.,The parish chief sensitized the community about the dangers of burning grass after digging.,[],,,[],[],general,general,original_composition,,Project_License,2026-02-23 05:14:16.931+00,z7cmq5grs
lehfx8ae3,AKARONKORONKO,Mixed,"Tradition ","Engenso, Enyikiriza n'emikorre ebitacweka",N,,,Kutiina amarogo  KARONKORONKO Kaira.,The fear of witch craft has been there ever since,Okulemwa abakama KARONKORONKO omu Bunyoro na Tooro,Kingship is Traditional in Bunyoro and Tooro.,[],"Emitwalize, ",,[],[],general,general,original_composition,,Project_License,2026-02-18 06:38:44.842+00,ruom6sfi4
lgn9l3afl,Emyandara,Mixed,"Rocks ",Amabaale agagumire muno mubuhangwanugo gaba musingi gw'ensozi.,N,ENV,,"Kyaaka haliyo emyandara nyingi, abantu bagikozesa kwanikaho.",There are many rocks in kyaaka and people use them to dry their food.,Abantu baira bahesaaga ebikwaatwa ebimu kuruga mumabaale egemengo.,People of long ag shaped stones to make grinding stones.,[],"omwandara(rock), emyandara(rocks)",,[],[],general,general,original_composition,,Project_License,2026-02-22 18:39:39.054+00,z7cmq5grs
lgyzkgknj,Abakorogi,Rutooro,Royal Milk men,Abanyamirwa abakamira omukama,N,,,Abakoroogi nibakuya Enkoroogi nukwo zigabye ziboneke ha Musanga.,The Royal  Milk men are massaging the cows for them to store much milk and look well  before the King.,"Abasumbi,Abasambu n'Abaisaigi nubo hati bali ha Murwa gw'okukorooga.","For the Ritual of Milking today, it is the Basumbi,Basambu and Basaigi on duty.",[],"Banyamirwa, Bakaami, Banyamalindwa",,[],[],general,general,original_composition,,Project_License,2026-02-17 10:31:16.499+00,ruom6sfi4
li74r194a,Amadirisa,Mixed,Window,Amadilisa gokukinga n`obulinzi,PRON,DLY,,"Ninkinga amadirisa, kutanga emibu kutaha munju",i close the windows to prevent mosquitoes from entering the house,Ninkingura amadirisa kuhweza,i open the windows so that i can see clearly,[],Obwingi bwa madirisa(Shutters),,[],[],general,general,original_composition,,Project_License,2026-02-16 13:55:47.766+00,xv6uqkb9l
li823vvdy,OMUKAMA,Mixed,"KING ",RUKIRABASAIJA,N,CUL,CUL-ROY,Oyo Nyimba Kabamba Iguru Rukidi iv nuwe Omukama wa Tooro.,Oyo Nyimba Kabamba Iguru Rukidi IV.,Solomon  Gafabusa  Iguru  IV  nuwe Omukama wa Bunyoro.,Solomon Gafabusa Iguru IV is the King of Bunyoro.,[],"OMULEMI,OBUKAMA,",,[],[],general,general,original_composition,,Project_License,2026-02-23 14:29:42.565+00,ruom6sfi4
lkzmwetdd,ekitetegekerwe,Mixed,unplanned,"ekikugwiremu ",V,NAR,,ekitetegegekerwe embwa ekairuka omukaro,unplanned thing the dog run away from smoked meat.,"ekitetegekerwe okuhulika kwisasi kukasigisa omukazi omwana yaheeka embwa. ",unplanned thing a  woman curried a dog instead of a baby after heard the bullet  sound.,[],"titwetegekere,tibetegekere,timwetegekere",,"[""V-STAT""]",[],general,general,original_composition,,Project_License,2026-02-17 15:00:29.295+00,7ldvwi8jh
lmpix6i1m,Kumwa,Mixed,"To shave ","Kukona
To trim  ",N,NAR,NAR-HIS,"Omubiro byaira muno omulingo bakozesaaga kumwa isoke, biki ebibakosaaga.",Long time ago the way they used to clean the head know what they were using.,"Abakuru bamwisaaga ahakubanza orusarangana, bayongeraho omuhyo gworumwiso ogwakozesibwaga kusara isoke,enono nenyama.","The elders were using at first the strong rib then after words they were using knife which was used to shave, cut meat and nails.",[],Kusara,,[],[],general,general,original_composition,,Project_License,2026-02-19 14:08:03.33+00,7ldvwi8jh
lnxgb5my4,Kukaranga,Mixed,fry,,V,AGR,,Kabasomi nakaranga oburo.,Kabasomi is frying millet.,Babanza kukaranga oburo nukwo babusa.,Millet is fried first before grinding.,[],drying,,[],[],general,general,original_composition,,Project_License,2026-02-19 21:15:23.863+00,wmqgng8ap
lojl366gm,Omuhanda,Rutooro,Journey,,N,,,,,,,[],,,[],[],general,general,original_composition,,Project_License,2026-02-23 07:04:48.428+00,7ldvwi8jh
lpfyamllv,Enguudo,Mixed,roads,Emihanda enyakuroho kukonyera abantu kugenda mu bikaro ebitalibimunabimu.,N,ENV,,Enguudo enungi zikoonyera abantu kukora emirimo yaabu.,Good roads ease communication and movement among the people.,Enguudo niziikonyera abantu kugenda kusoma n'okugenda mumarwarro.,Roads ease communities access to schools and healthcare centers.,[],,,[],[],general,general,original_composition,,Project_License,2026-02-22 16:29:12.492+00,z7cmq5grs
lpw7lxtwm,Kuhakaniza,Mixed,refusing,kuhaniza,V,DLY,,Ayangire kwikiriza ebibabalize.,She has refused to accept what they said.,Ayangire kwikiriza encwamu etali y'obwinganiza.,He has refused to follow unfair rule.,[],"kuhakaniza, kwangirra, rejecting",,[],[],general,general,original_composition,,Project_License,2026-02-22 08:12:19.548+00,1lzzop9e4
lpx5pbo5i,kujwaha,Mixed,Tired,wakohooka,N,NAR,NAR-FOL,omulimo gunu gunjwahize muno .,i am tired for this work.,nabaza tarukujwaha nakati.,spoke with out getting tired.,[],,17,[],[],general,general,original_composition,,Project_License,2026-02-17 21:15:05.301+00,7ldvwi8jh
lriuce60h,Omulimi,Mixed,Shamba boy,,N,EDU,,Omulimi w'obusiri bwebyakyo.,The shamba boy attends to flower gardens.,Omulimi wobusiri mugara.,The shamba boy is lazy.,[],,,[],[],general,general,original_composition,,Project_License,2026-02-19 13:45:43.327+00,wmqgng8ap
ls72oj3ci,Amapapali,Mixed,The popal,Ipapaali,N,CUL,CUL-FOO,,,,,[],,,[],[],general,general,original_composition,,Project_License,2026-02-21 19:50:27.21+00,7ldvwi8jh
lsrt4e369,Ebulaya,Mixed,irish potatoes,,N,AGR,,Tulirege ebitakuli.,We have eaten potatoes.,"Ebitakuli, ebilaya kubirya binura.",Potatoes are sweet to eat.,[],,,[],[],general,general,original_composition,,Project_License,2026-02-19 18:46:12.679+00,wmqgng8ap
lvbujmgjc,Ekigega,Rutooro,Basket,,N,,,,,,,[],,,[],[],general,general,original_composition,,Project_License,2026-02-23 09:16:46.302+00,7ldvwi8jh
lweenp9wv,Kubaganiza,Mixed,Divide,Yahuramu,V,DLY,,Yahuranamu entumo zomusenyi.,separete the sand into hips.,Yahuramu ebicooli nebihimba. .,Divide the maize and beans.,[],"yahukanizamu,(divide)",,[],[],general,general,original_composition,,Project_License,2026-02-21 09:58:13.071+00,1lzzop9e4
lyqn44by1,Orubbaho,Mixed,blackboard,,N,EDU,,Orubbaho rwokuhandiika omu kiteb barusiiga arangi erkuiragura.,Chalkboards in classrooms are usually painted black.,,,[],,,[],[],general,general,original_composition,,Project_License,2026-02-19 11:55:51.933+00,wmqgng8ap
m13xjhdgd,kupima,Mixed,to measure,kulenga,V,,,Noyetagisa kupima ebyorukugenda kutekamu.,you need to measure what your going to put.,Pima oburaiha bw'ekikaka kyawe.,measure the length of your sugarcane.,[],"pima,lengo",,[],[],general,general,original_composition,,Project_License,2026-02-17 21:05:35.009+00,7ldvwi8jh
m5vgue256,Kujaguza,Mixed,Celebrating.,Kusemererwa obusiguzi(obugenyi bwokusemererwa),V,DLY,,"Tubaire nitujaguza obugenyi bwamuhara wange amazire emisomo.   ",we have been celebrating my daughters birthday.,Ekijaguzo kyokugabura kikamara sabbiti yoona.,The wedding celebration lasted the whole week.,[],Kukunira(festivities),,[],[],general,general,original_composition,,Project_License,2026-02-21 11:47:05.022+00,1lzzop9e4
m7526lo3r,Nikyorobacekeceke,Mixed,,,N,DLY,,,,,,[],,,[],[],general,general,original_composition,,Project_License,2026-02-23 13:19:31.848+00,1lzzop9e4
m7cm3na0p,Engoma nyabahuma,Mixed,folk song( a song sang to stop their bride from crying),Ekizina kyokuhumuza omugole nukwo aleke kurra.,N,ART,,Engoma Nyabahuma ekaba nehahaisaniza naise omugole.,The works of Engoma Nyabahuma praised the brides and the as well.,Omugole bakamutwara nibazina Engoma Nyabahuma baitu etamuhumuze.,"They took the bride while singing Engoma Nyabahuma but she continued crying. ",[],,,[],[],general,general,original_composition,,Project_License,2026-02-20 12:56:08.377+00,z7cmq5grs
m7e4asdez,ABBOKI,Mixed,PET NAME,MPAAKO,N,,,Tooro ABBOKI mpaako ya Kato na Nyakato Baitu nabantu abandi nabo bagirukwa.,In Tooro Pet name Abboki  is given to  Nyakato and Kato [second twin] also others be given,"ABBOKI  mu Bunyoro teri mpaako ya barongo Kato na Nyakato.  Abo Babaruka  Adyeri. ",In Bunyoro Abboki is not for the second twin but Adyeri,[],Adyeri,,[],[],general,general,original_composition,,Project_License,2026-02-18 12:48:41.41+00,ruom6sfi4
m81bf7l6h,Kujubula,Mixed,Rinse,Kweza,V,DLY,,"Mujubule ebikopo ","Rinse the cups ",Jubula Esohani ezo,Rinse those plates,[],kweza(to cleanse),,[],[],general,general,original_composition,,Project_License,2026-02-16 13:14:55.089+00,xv6uqkb9l
m8ib9nhs5,Abatema,Mixed,ABATEMA is one of the clans in Bunyoro and Tooro,Abatema rumu ha Nganda eza Tooro na Bunyoro.,N,,,,,,,[],Enganda,,[],[],general,general,original_composition,,Project_License,2026-02-18 14:00:32.505+00,ruom6sfi4
m9z3cb7k8,Kunyunka,Mixed,"Mingling ","Kutobeza
Intermingling ",V,DLY,,Nyine enju abaire nahotora oburo.,The house wife was mingling millet flour.,Anyunkire oburo nobwegendereza tibwazaara byana.,"She mingled the millet flour carefully to avoid leaving in the particles. ",[],Kumamira,,[],[],general,general,original_composition,,Project_License,2026-02-21 07:46:12.942+00,7ldvwi8jh
marrlgaed,Enkerembe,Mixed,New born baby before the age of one year old.,Enkerembe yomwana.,N,DLY,,"Enkerembe yomwana mwojo, narra.",The baby boy is crying.,Enkerembe neyega kwajura.,The baby is learning how to crawl.,[],Ekibumba,,[],[],general,general,original_composition,,Project_License,2026-02-21 09:38:13.599+00,1lzzop9e4
mbcsdivht,Omwijurraine,Mixed,over population,Abantu kuba baingi bakakira ebintu ebyokukozesa,N,ENV,,Abantu obubarukuzaarwa baingi nibafundaomunsi.,"When the birth rate is high, the population will be squeezed in that particular place.",Emirimo enyakuroho tesobora kumara abantu habwokuba baingi muno.,The available jobs wont be enough for the big population.,[],,,[],[],general,general,original_composition,,Project_License,2026-02-23 07:35:55.686+00,z7cmq5grs
md2xvuq0i,Omutendeki,Mixed,Teacher,,N,EDU,,Omutendeki omurungi agonzibwa.,A good teacher is liked/loved.,Omutendeki omurungi akora ekyamanyire.,A good teacher does the correct thing.,[],"director, guider",,[],[],general,general,original_composition,,Project_License,2026-02-19 09:22:12.987+00,wmqgng8ap
mdbe2lgx1,Karusu,Mixed,Foot and mouth disease,,N,AGR,,Ente zoona zirwaire Karusu.,All cows are suffering from foot and mouth disease.,Oburwaire bwa karusu buturra.,Foot and mouth disease is contageous.,[],ejwa,,[],[],general,general,original_composition,,Project_License,2026-02-22 14:24:17.299+00,wmqgng8ap
mesoffkh8,Ebizina ebicwereriirwe,Mixed,a song created with words on a new subject and a new tune,Iraka erhyaka n'ebigambo ebihyaka ebyekuzina.,N,ECO,,Ekizinz yacwereriire hamusisa kikasemeza abantu.,The song he composed about the earthquake pleased many people.,Akacwererra ekizina ky'omumywererro kyayegesa baingi.,He composed anew song about AIDS and educated many.,[],,,[],[],general,general,original_composition,,Project_License,2026-02-20 09:34:15.244+00,z7cmq5grs
meuqprtfp,Kuhaswa,Mixed,Pheumonia,Infected,N,AGR,,Embuzi nazo irwaara kuhaswa.,Goats also suffer from pheumonia.,Embuzi zoona kazirwaire.,All the goats are diseased.,[],,,[],[],general,general,original_composition,,Project_License,2026-02-22 15:08:44.983+00,wmqgng8ap
mfitjol2b,Kucekeca,Mixed,to dance(vigorously using the waist),kuzina n'amaani nokozesa ebicweka byomubiri gwawe ebyenbajunogendara hangoma.,V,ART,,Bakacekeca muno oti rundi tibaina magufa!,They danced vigorously like as if they had no bones.,Bakacweka mumbaju bayoleka obukugu bwabo.,The displayed their expertise during the dance.,[],,,[],[],general,general,original_composition,,Project_License,2026-02-20 15:50:40.925+00,z7cmq5grs
mgsd3907l,Ekiteteyi,Mixed,Putting on a dress,omukazi najwara ekiteyi,V,DLY,,Omukazi atairemu ekiteteyi kirungi.,A woman is putting on a nice dress.,Ajwaire baitu ekiteteyi tikimuhikire kurungi.,She has put on unfitting dress.,[],,,[],[],general,general,original_composition,,Project_License,2026-02-22 09:31:13.384+00,1lzzop9e4
mgswp124f,Dora,Mixed,Look,,N,DLY,,,,,,[],,,[],[],general,general,original_composition,,Project_License,2026-02-23 11:23:39.788+00,1lzzop9e4
mhhqcc62x,Itaka,Mixed,soil,itaka,N,ENV,,Itaka niryo limeza ebimera.,Soil plays a vital role in plant growth.,Itaka erirungi liiragura.,Loam soil is commonly black.,[],,,[],[],general,general,original_composition,,Project_License,2026-02-21 16:24:53.94+00,z7cmq5grs
mhsl5rob8,Okuzaana,Mixed,"Playing is taking part in an activity for recreation,enjoyment i.e games etc.",Ekikorwa kyokwetaba mumizaano.,V,DLY,,Aboojo nibazaana omumpiira gwamaguru.,The boys are playing football.,Ogu nazaana nkweserekerire.,That one is playing hide and seek.,[],,,[],[],general,general,original_composition,,Project_License,2026-02-21 09:35:06.754+00,1lzzop9e4
mi99g0ww0,Kurubatirra,Mixed,tread of foot,,N,DLY,,,,,,[],,,[],[],general,general,original_composition,,Project_License,2026-02-23 11:43:18.308+00,1lzzop9e4
mjr5m6z1f,Ababwongo,Rutooro,,,N,,,,,,,[],,,[],[],general,general,original_composition,,Project_License,2026-02-18 14:00:32.505+00,ruom6sfi4
mll42yqgh,Abayaga,Rutooro,,,N,,,,,,,[],,,[],[],general,general,original_composition,,Project_License,2026-02-18 14:00:32.505+00,ruom6sfi4
mls5e6jym,KAZOOBA,Mixed,It is an attribute of God meaning God is the Sun Source of everlasting Light.,Ruhanga nuwe Kazooba Nyamutagwa.,N,SPR,,"Kazooba Nyamutagwa obwaraaba akyankwatiriire , ninyija kugura Bbasi.",I will buy  a Bus if Kazooba upholds my life.,Kazooba Nyamutagwa andinzire hamu  nabantu bange boona.,The everlasting Kazooba has kept me safe  with my family.,[],"Ruhanga, Izooba,",1,[],[],general,general,original_composition,,Project_License,2026-02-22 14:51:57.43+00,ruom6sfi4
movbzjrwc,Okuzaara,Mixed,"Bearing a child ","Kuzaara omwana ",V,,,OKUZAARA kirungi kukanyisa oruganda,Bearing children is good for the clan will expand.,OKUZAARA abarongo kisembo kuruga hali Ruhanga,Bearing tweens is a gift from God,[],"Kwejuna,",,[],[],general,general,original_composition,,Project_License,2026-02-18 08:21:37.798+00,ruom6sfi4
mowlg1fzt,kubiiha,Rutooro,"deceiving ",kuhyangya,V,NAR,NAR-FOL,wakame yabihabiha warugo,hare deceives the leopard,omuzaire omukazi nabihabiha omwanawe,"the mother deceiving her child ",[],"kubiiha,nabiiha,mubiihi",,[],[],general,general,original_composition,,Project_License,2026-02-16 09:23:36.109+00,7ldvwi8jh
ms7ak2ige,Omubiro,Mixed,Days of,Obusumi,V,NAR,NAR-HIS,Omubiro byaira muno hakaba haloho omusaija aine omukazi nomwana wobwisiki karungu.,Long long days ago there was a man who was having a wife and a child called Karungi.,Omubiro ebi hakaba haloho enjara y'amaani karungi yayekuba kunoga amakerre on the road side.,Those days there was too much hunger  Karungi went on the road side to collect some fruits called amakerre.,[],"ebiro, ekiro",,[],[],general,general,original_composition,,Project_License,2026-02-16 08:02:12.369+00,7ldvwi8jh
ms80xpjxk,OKUJWEKWA,Mixed,,,V,SPR,,,,,,[],"Kugumibwa, kwikalizibwa",,[],[],general,general,original_composition,,Project_License,2026-02-24 07:33:23.115+00,ruom6sfi4
muu4l8n1j,Abasiita,Rutooro,,,N,,,,,,,[],,,[],[],general,general,original_composition,,Project_License,2026-02-18 14:00:32.505+00,ruom6sfi4
muump0g4e,Kihangwa,Mixed,"creation ",Anyakuhangirwe,N,SPR,,,,,,[],"Obuhangwa, Ebihangwa, ebinyakuhangirwe,",,[],[],general,general,original_composition,,Project_License,2026-02-23 18:21:05.244+00,ruom6sfi4
mvyp1u3o5,ibaale,Mixed,The stone,omwandara,N,NAR,NAR-FOL,"Wakame kaali kasoro kagezi muno, engo ekaikarra yahanuura balye  bazaire baabu,  kandi wakame yasaba engo kubanza kulya owawarugo nukwo barayongeraho mwibaale buu","The hare was very clever animal ,the leopard sat with hare and they planed eat their mothers, and the hare requested leopard to first cook his mum then hare will be next. hare's mother taken in the stone ",nyina wakame akamara mwibaale obusumi bingi muno.,Hare's mother stayed in the stone for some long time.,[],"omwandara, ",8,[],[],general,general,original_composition,,Project_License,2026-02-17 21:36:43.428+00,7ldvwi8jh
mw11snyuf,Omuhimbo,Mixed,Excitment and Happiness,"Kugira omuhimbo ",N,DLY,,Nagira omuhimbo mwingi kukorora,Am extremely excitted to see you,Ntungire omuhimbo mwingi,am extremely excited,[],Nkyanganukire(extremely excited),,[],[],general,general,original_composition,,Project_License,2026-02-16 15:43:11.341+00,xv6uqkb9l
mw76nqxuv,Najunanizibwa,Mixed,responsibility,,N,DLY,,,,,,[],,,[],[],general,general,original_composition,,Project_License,2026-02-23 13:56:15.275+00,1lzzop9e4
mwhxporal,Kulera,Mixed,To nature the children.,Kulorerra abaana/omwana.,V,DLY,,omwana mulere kurungi.,nature the child with care.,Lera abaana nobahabura.,Advise the children with love.,[],Kworora obaana(Teaching the children good manners and guiding them),,[],[],general,general,original_composition,,Project_License,2026-02-21 13:29:13.127+00,1lzzop9e4
mwo9ww234,Wakame,Mixed,this is a hare,wakame ey'omukisaka,N,NAR,NAR-FOL,wakame egira amatu garaihirire kuhurra mahano.,The hare has long ears listening very faster.,wakame egira amagezi maingi muno.,Hare is a very wise animal.,[],"akame, kame, kasoro",9,[],[],general,general,original_composition,,Project_License,2026-02-16 07:39:39.108+00,7ldvwi8jh
mwy65aqpy,Orwemo,Mixed,Dinning room,Ekisika ky`okuliramu,N,DLY,,Tugende ha Rwemo,lets go to the dinning room,Nitulira mu rwemo,We eat from the dinning room,[],Obuliro(Eatery),,[],[],general,general,original_composition,,Project_License,2026-02-16 14:53:28.63+00,xv6uqkb9l
mxhajvodm,Ekirale,Rutooro,,,N,,,,,,,[],,,[],[],general,general,original_composition,,Project_License,2026-02-23 06:29:52.296+00,7ldvwi8jh
