id,word,dialect,definitionEnglish,definitionNative,pos,domain,subdomain,exampleSentence1,exampleSentence1English,exampleSentence2,exampleSentence2English,additionalSentences,relatedWords,nounClass,verbExtensions,tamMarkers,register,audience,sourceType,provenance,copyright,dateCreated,createdBy
ebwhscfgj,Kukeehya,Mixed,"Abbreviation ",kufunza,N,NAR,NAR-PER,,,,,[],,,[],[],general,general,original_composition,,Project_License,2026-02-24 09:10:39.777+00,7ldvwi8jh
ee56aieuq,Empunu,Mixed,Pig,,N,AGR,AGR-LVS,Empunu baitunga omu  maka.,Pigs are tame animals,Abantu baira tibalyaga mpunu.,The Banyoro and Batooro of long ago never used to eat pig meat.,[],pig meat,,[],[],general,general,original_composition,,Project_License,2026-02-21 14:58:50.875+00,wmqgng8ap
efsun1icg,Omwisija gwente,Mixed,Brucellosis.,,N,AGR,,Omuswija gutorogya ente.,Brucellosis causes miscarriage in cows.,Omuswija gwente gurwara na abantu.,People also suffer from brucellosis.,[],Fever,,[],[],general,general,original_composition,,Project_License,2026-02-22 14:32:26.569+00,wmqgng8ap
ehtympuza,Entwe zoburo,Mixed,balls,,N,AGR,,Oburo bugira entwe.,Millets have balls.,Entwe zoburo bazigesa.,Millet balls are harvested.,[],ebisi,,[],[],general,general,original_composition,,Project_License,2026-02-19 20:20:00.697+00,wmqgng8ap
eifiyd8h5,Ekikaransi,Mixed,chair for siting on comfortably.,entebe y'okwikarraho,N,DLY,,Caali letera omugenyi ekikaransi.,"Please, bring another chair for the guest.",Ikarra hakikaransi enyakulihaihi nidirisa.,sit on the chair near the window.,[],,,[],[],general,general,original_composition,,Project_License,2026-02-20 19:11:53.773+00,1lzzop9e4
em4fa10t3,Kuku kumbwa kw'itaka,Mixed,soil erosion,enjura kugwa nyingi ekatwara itaka,V,ENV,,Omuyaga mwingi  nagwo guhuha itaka eriru kworoba.,Strong winds also blow loose soils.,Kwaliirra kulinda itaka kutwarwa omuyaga n'omugezi.,Mulching protects soil surface running water and wind impacts.,[],,,[],[],general,general,original_composition,,Project_License,2026-02-23 06:42:48.322+00,z7cmq5grs
emczsf7em,Enfuuzi,Mixed,orphans,,N,DLY,,,,,,[],,,[],[],general,general,original_composition,,Project_License,2026-02-23 13:43:58.752+00,1lzzop9e4
en6bxays2,Amaani g'izooba,Mixed,Solar system,amaani g'izooba agakozirwe kuleta ekyerere n'obutagasi.,N,ENV,,Izooba liina amaani gamasanyarazi habwokuba tigarukusiisa buhangwa nkebindi.,Solar is a clean source of power because its disadvantages are few.,Amaani g'izooba bagakoramu amasanyarazi gokuhweza nokucumba.,Energy from the sun can be converted into electricity heat or light.,[],,,[],[],general,general,original_composition,,Project_License,2026-02-25 07:33:07.58+00,z7cmq5grs
enpgtvzc6,Kuhwa amani,Mixed,Weaken.,,N,GOV,,Obulemi bwa Bunyoro na Tooro bukamarwa amaani.,The governance in Bunyoro and Tooro was weakened.,Abanyoro na Abatooro bahati tibakyali nka abaira .,The Banyoro and Batooro of today are not as those of the past.,[],"kuchekebwa,  tibarukusisana",,[],[],general,general,original_composition,,Project_License,2026-02-22 07:07:10.867+00,wmqgng8ap
eqfww8mhc,Kukira,Rutooro,Heal,,N,,,,,,,[],,,[],[],general,general,original_composition,,Project_License,2026-02-23 07:39:03.612+00,7ldvwi8jh
ercdl91ti,ABAHEREZA,Mixed,,,N,SPR,,,,,,[],"Abaliisa, Abasesedoti, Abahuule, Abasomesa, ",,[],[],general,general,original_composition,,Project_License,2026-02-24 07:50:31.463+00,ruom6sfi4
es8pzlhp0,kwega,Mixed,learn,kukwata,V,NAR,NAR-FOL,kwega kubaza mubantu kikuru muno.,"learning to speak in public is very important. ",kwega nkoku bacumba ebyokulya ebirungi.,learning how to cook good food.,[],"kumanya,kwetegereza",,[],"[""T-PAST""]",general,general,original_composition,,Project_License,2026-02-16 12:17:57.756+00,7ldvwi8jh
esb7cctbo,Tweyongereyo,Mixed,let us extend,,N,DLY,,,,,,[],,,[],[],general,general,original_composition,,Project_License,2026-02-22 06:38:26.962+00,1lzzop9e4
esznzo7dv,Ekibira,Rutooro,Forest,,N,,,,,,,[],,,[],[],general,general,original_composition,,Project_License,2026-02-23 07:10:38.655+00,7ldvwi8jh
euh8g9ksi,Kusiima,Mixed,appreciating,nsimire,V,DLY,,Kansiime emirimo eyorukukora.,I appreciate the you are doing.,Ninsiima embabazi onyolekeze.,I appreciate the love you have shown me.,[],otyo muno(thank you),,[],[],general,general,original_composition,,Project_License,2026-02-22 08:33:56.664+00,1lzzop9e4
exxmtcmb2,Ekitonsa,Mixed,large mashroom,,N,DLY,,,,,,[],,,[],[],general,general,original_composition,,Project_License,2026-02-23 13:32:02.206+00,1lzzop9e4
eygrwdmyl,Empogora zebinyobwa,Mixed,"The cooked groundnuts with hasks ",Ebyensusu,N,DLY,,"Ebinyobwa osobora kubirya bibisi bitakomere, Empogora rundi ebyomere.","Groundnuts can be eaten when they still fresh, cooked with hasks or dry.",Obinyobwa  twihamu emikubi  nyingi.,"We have different types of source in groundnuts. ",[],Binyobwa,,[],[],general,general,original_composition,,Project_License,2026-02-21 18:28:56.271+00,7ldvwi8jh
ez0ndat6r,Bali,Mixed,those people,abantu bali,N,DLY,,Bali abantu baizirege hanu ijo.,Those people came here yesterday.,Abantu bali nibasobora omulimo ogu.,Those people are able to do that work.,[],abantu,,[],[],general,general,original_composition,,Project_License,2026-02-22 10:26:03.899+00,1lzzop9e4
ez2rwq28e,kuhuliriza,Mixed,"to listen ",okuhuliriza kikuru muno muno,V,NAR,NAR-FOL,kuhliriza kintu kikuru muno muno kiretaho obusinge.,"listening is very, very important it brings peace. ",kuhuliriza kukonyera abantu kukora ebihikire omubwire obunyakuhikire.,listening helps people to do right things at a right time,[],"ohulirize, muhulirize. muhulirize",,[],[],general,general,original_composition,,Project_License,2026-02-17 01:42:35.614+00,7ldvwi8jh
ezvzoc92j,Obudoma,Mixed,stupidity,,N,EDU,,Obudoma ndwaire.," Stupidity is sickness.",Owawe kudoma hakire afa.,A person to be stupid would rather die.,[],"obutamanya, obudomadoma",,[],[],general,general,original_composition,,Project_License,2026-02-18 12:39:58.87+00,wmqgng8ap
ezwdcfssl,Abaraha,Rutooro,,,N,,,,,,,[],,,[],[],general,general,original_composition,,Project_License,2026-02-18 14:00:32.505+00,ruom6sfi4
f0qzlbsbd,Kweragira,Rutooro,,,N,,,,,,,[],,,[],[],general,general,original_composition,,Project_License,2026-02-19 13:47:56.735+00,7ldvwi8jh
f0tjiz17n,Bunabi,Mixed,prophecy,,N,DLY,,,,,,[],,,[],[],general,general,original_composition,,Project_License,2026-02-23 11:34:45.985+00,1lzzop9e4
f3cwfc4e6,kugaruka,Rutooro,,,N,,,,,,,[],,,[],[],general,general,original_composition,,Project_License,2026-02-19 13:25:01.328+00,7ldvwi8jh
f3h2sr8sy,Abasazima,Rutooro,,,N,,,,,,,[],,,[],[],general,general,original_composition,,Project_License,2026-02-18 14:00:32.505+00,ruom6sfi4
f5l7sa65r,Ekisiika,Mixed,Wall,Orusiika,N,NAR,NAR-CHI,kiteeke hakisiika buliomu  akirole.,''Put it on the wall so everyone to see.'',leka kurubatira omumwirima otaija kuhumira ekisiika.,''Do not walk in the darkness you might bump into the wall.'',[],Ebisiika,,[],[],general,general,original_composition,,Project_License,2026-02-24 08:22:06.752+00,7ldvwi8jh
f5xg62py5,Emikingiro,Mixed,contour planting,Emyekiiro enyakwegemere enyakutebwa harusozi,N,ENV,,Embibo ye yoona ekatwaarwa omugezi habwokuba akeebwa kuta emikingiro harusozi.,ALL THE SEEDS WERE WASHED AWAY BY RAIN WATER BECAUSE HE LACKED CONTOURS TO PROTECT EROSION.,Harusozi bataho emikingiro yakutanga omugezi kandi nambere haterekeriire otaho emyekiiko.,"When you dig on the hill, you put curved terraces to protect soil erosion.",[],,,[],[],general,general,original_composition,,Project_License,2026-02-25 07:25:41.874+00,z7cmq5grs
f6l9zo9v9,Abatwairwe,Rutooro,,,N,,,,,,,[],,,[],[],general,general,original_composition,,Project_License,2026-02-18 14:00:32.505+00,ruom6sfi4
f6moorodl,Kusorra,Mixed,digging(surface),,V,AGR,,Omukozi alimire nasorra.,The worker has dug on the surface only.,Banza osorre nukwo ohange.,First do shallow digging then dig deep.,[],on top(haruguru),,[],[],general,general,original_composition,,Project_License,2026-02-19 18:18:37.747+00,wmqgng8ap
f9prk3q5t,Ekiguude,Mixed,,,N,,,,,,,[],,,[],[],general,general,original_composition,,Project_License,2026-02-21 14:49:14.214+00,7ldvwi8jh
fb7wfnnj2,Abanyamirwa,Mixed,Ritualists,"Abakozi Bemirwa ",N,,,abanyamirwa barumu ebitongole bingi,"Ritualists are divided in different sections ",Abanyamirwa ba Tooro boona bakyali bato,the ritualists in Tooro most of them are still young people,[],"Omujaguzi, Abakondere, Omweganywa",,[],[],general,general,original_composition,,Project_License,2026-02-17 06:24:47.484+00,ruom6sfi4
fbmzilyan,Kwoma,Mixed,dry,,V,AGR,,Ebinyansi byomere tubyokye.,The grass is dry we can burn it.,Muhogo bakagyasa bagyanika eyomere.,The sliced cassava is now dry.,[],kukamuka.,,[],[],general,general,original_composition,,Project_License,2026-02-19 17:32:14.604+00,wmqgng8ap
fc2uo2b75,Ekicumuro,Mixed,a burnt stick in fire,,N,DLY,,,,,,[],,,[],[],general,general,original_composition,,Project_License,2026-02-23 13:25:56.071+00,1lzzop9e4
fdl4rrs3h,Omuragora,Mixed,seeds,,N,AGR,,obubabuhunika hasigarho omuragura.,When millet is put in the granary seeds remain.,Omuragara baguhunikire omu kitundwa.,Seeds have been stored in the grass storage.,[],seeds,,[],[],general,general,original_composition,,Project_License,2026-02-19 20:40:19.998+00,wmqgng8ap
ffjcpn93m,AMASU,Mixed,,,ADJ,SPR,,,,,,[],"Kubawenka, Kutabanabantu,",,[],[],general,general,original_composition,,Project_License,2026-02-23 18:30:39.371+00,ruom6sfi4
fgkvk8pmo,Akacumu,Mixed,Pen,,N,EDU,,Akacumu kahandiika kurungi.,The pen writes well.,Obucumu bukozesebwa mukuhandikisa.,Pens are used for writing.,[],"fountain pens, ball point pens, bic pen",,[],[],general,general,original_composition,,Project_License,2026-02-18 13:15:37.586+00,wmqgng8ap
fhk9yuntc,Omwekengi,Mixed,careful indeed,,N,EDU,,Mukuru w'isomero mwekengi mukuru muno.,He is a very careful headteacher.,Mukaziwe akerinda ha isomero.,The wife cared for herself while at school.,[],"reserved, self respect, disciplined",,[],[],general,general,original_composition,,Project_License,2026-02-18 15:27:32.18+00,wmqgng8ap
fjkcb8ieu,Kwikara,Mixed,To stay,Kugumaho,V,NAR,NAR-FOL,Kwikara hamu  nka nyin'emu,To stay together like brothers and sisters,Kwikara omukikaro kimu nikujwahya wewe,To stay in the same place makes you tired.,[],"Ikara,ikaraho, baho,gumaho",,[],[],general,general,original_composition,,Project_License,2026-02-16 08:14:15.463+00,7ldvwi8jh
fjraecq1w,Obutafayo,Mixed,Carelessness(not giving enough attention which can cause mistakes),obutaba nobujunanizibwa nikisoborakuleta ensobi,V,DLY,,"Ogu abantafayo, ntabiganya.",That person is not responsible.,"Habwaki oba ntafaho, mali torugunya ekintukyona?",Why are you careless surely are you not caring at all?,[],,,[],[],general,general,original_composition,,Project_License,2026-02-21 20:12:15.176+00,1lzzop9e4
flsvplo4y,Ninkusaba,Mixed,,,N,DLY,,,,,,[],,,[],[],general,general,original_composition,,Project_License,2026-02-22 06:37:33.638+00,1lzzop9e4
fm3qp4bhk,kinu,Mixed,,,N,,,,,,,[],,,[],[],general,general,original_composition,,Project_License,2026-02-19 13:40:54.306+00,7ldvwi8jh
fmc5z4m13,Okuboneka,Mixed,Eating of the King,"Omukama aboneka, Talya.",V,,,Omukama  naalya Muleke kutooka,The king is eating don't make noise,Omukama amazire Kuboneka,The King has finished eating,[],"Kulya, Kunywa",,[],[],general,general,original_composition,,Project_License,2026-02-17 02:55:26.686+00,ruom6sfi4
fmxqf4qg1,kusiba,Mixed,to tie,kusiba ekintu nokisibikisa omuguha rundi ekintu kyona,V,,,Kusibika embuzi nomuguha hakiti,To tie a got with a rope,kusiba emiguha yokutunda,To tie ropes for sale,[],"siba,asibire,kuboha",,[],[],formal,general,original_composition,,Project_License,2026-02-16 14:22:50.964+00,7ldvwi8jh
fnvkwtmg7,Abagizi,Rutooro,Confidant Workers of the King,Abakozi abesigwa ab'omukama,N,,,Omukama akeeta abagizi be yabatuma kumukorra emirimo etali emu,"The king called his trusted workers and assigned them different assignments. ","Abagizi b,omukama tibali boona abakora buli kiro",Not all Bagizi who do every day duty.,[],"muhereza, Mukoyezi",,[],[],general,general,original_composition,,Project_License,2026-02-17 05:20:12.866+00,ruom6sfi4
fpyftw9o8,Obujabara,Mixed,,,N,,,,,,,[],,,[],[],general,general,original_composition,,Project_License,2026-02-21 14:11:46.631+00,7ldvwi8jh
fq43914q8,Emikonde,Mixed,banana stem,,N,AGR,,emikonde yebitooke eribwa ente.,Banana stems are eaten by cows.,Emikonde eyalirra engonjo zebitooke.,Banana stems are used to mulch plantations.,[],emigogo,,[],[],general,general,original_composition,,Project_License,2026-02-20 08:26:18.529+00,wmqgng8ap
fr02rhuat,Obuhangwa,Mixed,Environment(surroundings in which people and animals live),,N,ENV,,Omuyaga gunagire enjuye babwokutema emiti eyali emwehinguliriize.,The wind attacked the house because of cutting the trees around his house.,"Ebentu ebitwehinguliriize bitaha ebyokulya, amaizi n'erwooyarwokuhikya.","The things around us provide us with food, water and air.",[],,,[],[],general,general,original_composition,,Project_License,2026-02-21 15:15:36.349+00,z7cmq5grs
fsol11yrm,Enguha,Mixed,Ticks,,N,AGR,,"Enguha irwaza ente.
",Ticks cause cows to be sick.,"Ente ezine enguha baifuhira.  ",Cows with ticks should be sprayed,[],,,[],[],general,general,original_composition,,Project_License,2026-02-22 14:40:58.169+00,wmqgng8ap
ftaa46ufr,"MUSANA,",Mixed,,,ADJ,SPR,,,,,,[],,,[],[],general,general,original_composition,,Project_License,2026-02-23 08:44:36.061+00,ruom6sfi4
ftlitcqa6,Emikakaro,Mixed,Dried Banana,Embiira,N,CUL,CUL-FOO,Binu ebitooke babihaata babyanikira/ babyengesa.,"These  are multipurpose  types of bananas which can be use and treading juice. ","Emikakaaro bagijojeza, bagyanika bagyahura.","These bananas are fermented, dried and kept.",[],embiira eyanikiirwe.,,[],[],general,general,original_composition,,Project_License,2026-02-21 11:51:25.194+00,7ldvwi8jh
ftzhdqrdh,Emiringo,Mixed,types,,N,AGR,,Ebitooke byemiringo nyingi.,Bananas are of different types.,Haroho abantu abatalya ebitooke.,There are some people who do not eat bananas.,[],ebika,,[],[],general,general,original_composition,,Project_License,2026-02-20 08:10:55.55+00,wmqgng8ap
fv9nr67kf,akoraheeka,Mixed,"the luggage will carry ",ekyorukugonza,V,NAR,NAR-FOL,okaraheeka tokaisa rume,"the luggage you will carry, don't wetted it.",orufumo runu nirwegesa omuntu kuha ekitinisa omulimogwe.,"this proverb tells how you supposed to respect your work. ",[],"kuheeka,heeka, kuhimba.",,[],[],general,general,original_composition,,Project_License,2026-02-17 21:55:04.739+00,7ldvwi8jh
fvs39ujzu,Ebizina by'enzaarwa,Mixed,Traditional folk songs(songs handed to us from generation to generation),Ebizina ebyaziriirwe baisenkuru itwe abo ira habwemikore eyobusi bwensi.,N,ART,,Ekizina kibaire kya ira kwo.,The song he presented was truly of long ago.,Ekizinakye kibaire nikikwataho hakugesa oburo.,The folk he presented was related to millet harvesting.,[],,,[],[],general,general,original_composition,,Project_License,2026-02-20 10:00:46.478+00,z7cmq5grs
fwxcliok7,Amagita .,Mixed,Oil,,PART,AGR,AGR-LVS,Ebinyobwa birumu amagita.,Ground nuts have oil.,Amagita galeta ebisajwa.," 0il has fats.",[],,,[],[],general,general,original_composition,,Project_License,2026-02-21 12:12:55.888+00,wmqgng8ap
fxh4meex5,Balimi,Mixed,they grow crops,,N,AGR,,Abanyoro na Abatooro boona balimi.,The Banyoro and Batooro both grow crops.,Abasaija na bakazi balimi.,Both men and women grow crops.,[],baliisa,,[],[],general,general,original_composition,,Project_License,2026-02-19 16:21:30.598+00,wmqgng8ap
fy38o2t88,Kugunura,Mixed,Widening eyes,Kugunura Amaiso,ADJ,NAR,NAR-FOL,Engo yagunura amaiso,The leopard widened its eyes,Omukazi yagunura amaiso,The woman widen her eyes,[],"agunwire,gunura,egunwire",,[],[],general,general,original_composition,,Project_License,2026-02-16 08:29:52.397+00,7ldvwi8jh
g3rtunvf1,Ekutiya,Mixed,half pet,ekipumpulira ky'omunda.,N,DLY,,Abandize yajwara ekipumpulira omunda.,She first dressed a half pet before putting on the wrapper.,Ekutiyaekonyera ekitambi obutakwebohaboha.,The half pet protects the lower wrapper to b tidy.,[],akakoohi k'omunda,,[],[],general,general,original_composition,,Project_License,2026-02-22 09:46:50.07+00,1lzzop9e4
g4z9dw08h,Amooti,Mixed,Pet name,Mpaako,N,,,AMOOTI  erukwa abarongo Nyangoma na Isingoma,Pet name given to the first twin Isingoma or Nyangoma,Amooti tekangira [kugarukira] ha Barongo bonka nabantu abandi bagirukwa.,Amooti can also be given to any other Person,[],Empako,,[],[],general,general,original_composition,,Project_License,2026-02-18 12:26:57.68+00,ruom6sfi4
g592uj053,Kusereka,Mixed,Hiding,,V,DLY,,Nserekire kimu nasonseka hara.,I hid it very far.,Osereke obudikire kimu.,,[],,,[],[],general,general,original_composition,,Project_License,2026-02-22 08:16:11.466+00,1lzzop9e4
g5b9h0sbq,nyantagambirwa,Mixed,mischievous,Entahurra,V,NAR,NAR-FOL,nyatagambirwa akatangatangana obuzibu mubwomezibwe.,the person don't want listen meats problems in life.,nyantagambirwa akaheeka orunaku,The person who is unlisten go problems.,[],"entahurra,obutagambirwa",,[],[],general,general,original_composition,,Project_License,2026-02-17 21:55:56.74+00,7ldvwi8jh
g5tynwer9,Kusweerwa okali muto,Rutooro,early marriages,kusweera nokuserwa kara otakakuzire kurungi.,V,ENV,,Muhara wange akansweerwa kara y'azaara anaana baingi habwo kucwereerra.,My daughter had early marriage and frequent pregnancies.,Akazaara kara kandi baingi bamusaba itaka lyamubura.,He started producing early and later the many children demanded for land which he didn't have.,[],,,[],[],general,general,original_composition,,Project_License,2026-02-23 09:17:11.119+00,z7cmq5grs
g68telcw8,Kwogya,Rutooro,To wash,Kwecuma,V,NAR,NAR-CHI,"Omwana omurofu , obwatagira nsoni darawe omubantu ahangalikirwe,aba nyatagambwaho omurole nkooku yayemerra eminogo.",The child was given  names like dirty boy,Hingura hakanyuma mwana wange kiki? baragira kiki ekagyaha?,,[],,,[],[],general,general,original_composition,,Project_License,2026-02-19 13:56:23.39+00,7ldvwi8jh
g7sxdai8m,Kutabangura orwooya,Mixed,Air pollution,Emiika/orwooya orubi oruli mumwaanya niruleetwa ebintu ebitali bimu nka amakooro.,V,ENV,,Emiika eyakugenda mumwaanya neruga mubiruka rundi mu makoorro yakabi habwomeezi bwaitu.,Polluted air can be very harmful to our health.,Kubyaara emiti nikikoonyera kukeehya obuleemeziobworooya rubi mumwaanya.,Planting trees can reduce the problem caused by pollution.,[],kusiisa orwooya(spoil the air),,[],[],general,general,original_composition,,Project_License,2026-02-22 20:21:18.906+00,z7cmq5grs
g892owjkq,Okubaza,Mixed,talking(speaking a away of communicating to people),kubaza nugwo omulingo gwokugambira abantu,V,DLY,,Leka tubaze hamu.,Let us talk together.,Ija tukibazeho.,Come and we talk about it.,[],"kugamba, mugambire(telling, speaking, communication)",,[],[],general,general,original_composition,,Project_License,2026-02-22 13:24:46.286+00,1lzzop9e4
gb5h1c18f,emikubi,Mixed,Traditional source,omukubi,N,CUL,CUL-FOO,Emikubi tugira eyembaganiza.,"We have different types of source. ",Buli gumu gwine emicumbire yagwo.,Every type of source has a way of being prepared.,[],ekyokukozamu.,,[],[],general,general,original_composition,,Project_License,2026-02-21 11:57:29.048+00,7ldvwi8jh
gcnipmcye,AMABONA,Mixed,The eyes of the king,Amaiso g'Omukama,N,,,Muntwale MUMABONA g'Omukama naija kunkonyera.,Take me to the presence  of the king and  will help me.,Kiro kinu mbaire OMUMABONA g'Omukama namusoborra ebirukufa Masindi.,Today i attended the King and gave him  information about Masindi.,[],"Amaiso,  ",,[],[],general,general,original_composition,,Project_License,2026-02-18 05:34:50.876+00,ruom6sfi4
gdt4d4d43,Empangoo,Mixed,Abig short drum played in the king's palace,Engoma Engufu cerukoto muno erakuteerwe mukikaali,N,ART,,Omukama aigurwire empango rurangi abantu basemererwa,"The king played the Drum well, and the people were happy",Empango tegambire kurungi habwokuba ebaire ehumiikireho,The King's drum sounded badly because it had a hole,[],,,[],[],general,general,original_composition,,Project_License,2026-02-21 14:28:14.319+00,z7cmq5grs
gfzsy2svz,OBUHEREZA,Mixed,,,N,SPR,,,,,,[],"Okuhereza,Abahereza,",,[],[],general,general,original_composition,,Project_License,2026-02-24 04:58:09.209+00,ruom6sfi4
ghftu3w88,Ekisozi,Mixed,Hill,Obusozi,N,NAR,NAR-PER," Omukazi kaba ali hakisozi eruguru yalengera  Bunyoro and Tooro.",The woman stands on the hill overseeing Bunyoro and Tooro.,,,[],Ebisozi,,[],[],general,general,original_composition,,Project_License,2026-02-23 09:02:46.369+00,7ldvwi8jh
ghwqzn0fv,Kuzana,Mixed,drama,,V,EDU,,Emizaano esemeza abantu.,Drama is very entertaining.,,,[],"omuzano, kuzana",,[],[],general,general,original_composition,,Project_License,2026-02-19 14:22:50.722+00,wmqgng8ap
gjr2wn4au,Omwetegereza,Mixed,a critical person.,omuntu arukwecumitiriza.,N,DLY,,Ayecumitirize muno ensonga ezo.,Has critically analyzed those issues.,Akakecumitiriza muno yakaguza ebikaguzo nukwo atunge obwakaiso obugumire.,She critically asked questions so that she may get proper evidence.,[],omwetegya,,[],[],general,general,original_composition,,Project_License,2026-02-21 21:06:05.115+00,1lzzop9e4
gk1otda96,Kutera oburo,Mixed,pounding,,V,AGR,,Aboojo nibatera oburo.,Boys are pounding millet.,Entwe zoburo bazitera.,Millet balls are pounded.,[],squeezing,,[],[],general,general,original_composition,,Project_License,2026-02-19 20:33:58.195+00,wmqgng8ap
gnst2r1y5,Mpora,Mixed,Slowly,,ADJ,GOV,,"Omwebembezi akwata mpora ",A leader does things slowly.,Mpora mpora akahikya omwebembezi hakyarukwenda.,A leader achieves the good by going slowly.,[],,,[],[],general,general,original_composition,,Project_License,2026-02-22 09:00:43.37+00,wmqgng8ap
goea54lmy,enjoka,Mixed,worms,,N,AGR,,Ente nembuzi birwara enjoka.,Cows and goats suffer from worms.,Ente nembuzi bihe omubazi gwenjoka.,You should drench cows and goats.,[],,,[],[],general,general,original_composition,,Project_License,2026-02-22 15:14:11.246+00,wmqgng8ap
gqsylh4ed,EBYEKWASO,Mixed,,,V,SPR,,,,,,[],"Obumanzi,Kwetinirra,",,[],[],general,general,original_composition,,Project_License,2026-02-23 18:47:21.165+00,ruom6sfi4
gr2p520e7,AMASU,Mixed,,,ADJ,SPR,,,,,,[],"Kubawenka, Kutabanabantu,",,[],[],general,general,original_composition,,Project_License,2026-02-23 18:30:44.656+00,ruom6sfi4
gruhtb5gk,EKIBI,Mixed,,,N,SPR,,,,,,[],,,[],[],general,general,original_composition,,Project_License,2026-02-23 18:49:46.094+00,ruom6sfi4
gwzisv45o,Kumpa,Rutooro,,,N,,,,,,,[],,,[],[],general,general,original_composition,,Project_License,2026-02-19 13:43:14.169+00,7ldvwi8jh
gzdevl9rd,Esuuku,Mixed,cover,,N,AGR,,Esuuku eswekerra enguli.,The granary has a cover.,Esuuku nebiti hamu n'obunyansi.,The cover of the granary is made of wood and grass.,[],ekisweko,,[],[],general,general,original_composition,,Project_License,2026-02-20 07:54:06.851+00,wmqgng8ap
h1tdx73q9,NYINEKA TANABIRA RUBANGO,Mixed,Husband does not wash hands for nothing,Nyin'ekka tanabira busa nambere ebyokulya bitali,V,,,Okunabira orubango kibi obwogenda oti ogwa ensazi.,It is risky to wash for no food in the morning because one may collapse  in the day.,Tonabira Rubango kwonka kikonyera Nyin'enju kwikara nebyokulya ebyokuha Nyin'eka. buli Nyenkyakara.,"Not to wash for nothing Taboo, do encourage the wife to store enough food for break fast to the husband. ",[],"Ebyokulya, Okulya.",,[],[],general,general,original_composition,,Project_License,2026-02-21 09:56:32.787+00,ruom6sfi4
h2pqaxg9d,Muhanuuzi,Mixed,Counsellor,,V,EDU,,Omwana muhanuuzi.,A good councilor.,Yesu akabaali muhanuuzi.,"Jesus was a good councilor. ",[],muhi wamagezi( adviser).,,[],[],general,general,original_composition,,Project_License,2026-02-18 10:46:44.026+00,wmqgng8ap
h3nnv2ogc,Murofu,Mixed,Dirty,To be dirty.,V,EDU,,Omukazi murofu.,"The woman is dirty.
A dirty woman.",Kibi kuba murofu.,It is bad to be dirty.,[],"kirofu( it it dirty), harofu(here it is dirty).",,[],[],general,general,original_composition,,Project_License,2026-02-18 11:27:47.64+00,wmqgng8ap
h41fft1fi,MWINGANI,Mixed,,,ADJ,,,,,,,[],"RUHANGA,",,[],[],general,general,original_composition,,Project_License,2026-02-23 09:21:56.357+00,ruom6sfi4
h4l6qroq9,Kuculera,Mixed,quiteness,,V,EDU,,Kuculera muno buba budoma.,Being to quite is wrong/bad.,Kuculera kwingi kibi.,Being too quite is bad.,[],"humble, obedient",,[],[],general,general,original_composition,,Project_License,2026-02-18 12:51:44.597+00,wmqgng8ap
h4y20xb97,OBWOMEEZI,Mixed,,,N,SPR,,,,,,[],"Kwomeera, Omuntu,",,[],[],general,general,original_composition,,Project_License,2026-02-23 13:25:57.05+00,ruom6sfi4
h6fmjkqw5,Kuhaata,Mixed,peeling,,V,AGR,,abaisiki nibahaata.,Girls are peeling.,Aboojo nabo bahaata.,Boys also do the peeling.,[],,,[],[],general,general,original_composition,,Project_License,2026-02-19 19:00:51.442+00,wmqgng8ap
h7akji2de,Kwikirraniza,Mixed,,,N,DLY,,,,,,[],,,[],[],general,general,original_composition,,Project_License,2026-02-22 06:47:05.738+00,1lzzop9e4
h81gmlhcg,MUKISISANI,Mixed,,,N,SPR,,,,,,[],"RUHANGA, MUKUSISANA,",,[],[],general,general,original_composition,,Project_License,2026-02-23 18:25:00.075+00,ruom6sfi4
hckg4liel,Enyamusiri,Mixed,slippery source,omukubi gurukwiragura,N,CUL,CUL-FOO,Dodo erukuterra nungi egumya amagufa,"slippery dodo is good makes bones strong. ",Bakira kugirisa oburo.,mostly eats with millet bread.,[],dodo erukuterra.,,[],[],general,general,original_composition,,Project_License,2026-02-21 12:09:59.868+00,7ldvwi8jh
hdmpjm7d8,bombo,Mixed,spraying machine,,N,AGR,,Bombo bagikozesa kufuhirra.,Spraying machine is used to kill insects like ticks.,Omubazi bagutabura omu maizi nukwo bafuuhiirra.,Insecticides is mixed with water when spraying.,[],,,[],[],general,general,original_composition,,Project_License,2026-02-22 14:32:46.324+00,wmqgng8ap
