word,definitionEnglish,definitionNative,exampleSentence1,exampleSentence1English,exampleSentence2,exampleSentence2English,dialect,pos,domain
Obuguda,The wealth of a person is seen on the cattle he owns.,obuguda bwomuntu burolerwa hali ente azaine.,obuguda bwomuntu burolerwa hali ente azaine.,The wealth of a person is seen on the cattle he owns.,,,Both,,
Obunaku,Poverty is very bad.,obunaku kibi muno.,obunaku kibi muno.,Poverty is very bad.,,,Both,,
kuruka,My mother is well known as mat weaver.,Nyina nyowe amanyirwe nkomuruki w'emikeeka.,Nyina nyowe amanyirwe nkomuruki w'emikeeka.,My mother is well known as mat weaver.,,,Both,,
okusuma,am grateful to God today am eight years old,ninsiima ruhangawiro kimu mpikize wmyaka zo,ninsiima ruhangawiro kimu mpikize wmyaka zo,am grateful to God today am eight years old,,,Both,,
okufuhya,It is forbidden a wife to beat her husband.,Nikafuhe omukazi okuteera iba.,Nikafuhe omukazi okuteera iba.,It is forbidden a wife to beat her husband.,,,Both,,
omunyambabazi,a foster parent raised a child who had no mother,omunyambabazi a kakuza omwana ataina nyina,omunyambabazi a kakuza omwana ataina nyina,a foster parent raised a child who had no mother,,,Both,,
emigenzo,In our custom of Tooro and Bunyoro we use pet names while greeting each other.,Omumigenzo yaitu Bunyoro na Tooro itwe turamukya ne mpaako.,Omumigenzo yaitu Bunyoro na Tooro itwe turamukya ne mpaako.,In our custom of Tooro and Bunyoro we use pet names while greeting each other.,,,Both,,
omuhuza,the guardian looked after children of other people but when they grew,omukuza akakuga abaana batalibe bwitubobumazire kukura bamukonyera,omukuza akakuga abaana batalibe bwitubobumazire kukura bamukonyera,the guardian looked after children of other people but when they grew,,,Both,,
omuguletwa,the role of the heir is to look after the mother and sister,omugwerwa alinda nyina ramu nabaana,omugwerwa alinda nyina ramu nabaana,the role of the heir is to look after the mother and sister,,,Both,,
obugweterano,"Pet names are our heritage, let us keep them .",Empaako zaitu kyobugweterano bwaitu leka tuzirinde.,Empaako zaitu kyobugweterano bwaitu leka tuzirinde.,"Pet names are our heritage, let us keep them .",,,Both,,
Amadaara omubulemi,Uganda has a lot of hierarchy in governance.,Uganda ina amadaara omubulemi.,Uganda ina amadaara omubulemi.,Uganda has a lot of hierarchy in governance.,,,Both,,
qamakune,my son is law is a person of hospitality,muko wange aba wamakune maingi,muko wange aba wamakune maingi,my son is law is a person of hospitality,,,Both,,
Ekaaro mubantu,The rank of someone is shown by what he does and what he owns.,Ekaaro mubantu nizisangwa omuli emirimo eyakora nobuguda bwebintu.,Ekaaro mubantu nizisangwa omuli emirimo eyakora nobuguda bwebintu.,The rank of someone is shown by what he does and what he owns.,,,Both,,
kukwataniza,let us cooperate in everything we shall suceed,tukorre hamu omubulikimu nitwija kubingura,tukorre hamu omubulikimu nitwija kubingura,let us cooperate in everything we shall suceed,,,Both,,
kubuumba,Pottery was a good industry in the past.,Kubumba ebinaga gwali mulimo murunji.,Kubumba ebinaga gwali mulimo murunji.,Pottery was a good industry in the past.,,,Both,,
Abakama/Abaguda,Nobility is for kings and the rich in our area.,Abakama nabaguda nubo batunga ekitiniisa omunsi yowaitu.,Abakama nabaguda nubo batunga ekitiniisa omunsi yowaitu.,Nobility is for kings and the rich in our area.,,,Both,,
omwombeki,A builder does his worker carefully.,Omwombeki akora emirimo nayegendesereza.,Omwombeki akora emirimo nayegendesereza.,A builder does his worker carefully.,,,Both,,
ekinaga,The cooking pot cooks well the food.,Ekinaga kihiisa kurungi ebyokurya.,Ekinaga kihiisa kurungi ebyokurya.,The cooking pot cooks well the food.,,,Both,,
Omusubuzi,A trader benefits more than the producer.,Omusubuzi agobamuno okukira omulimi.,Omusubuzi agobamuno okukira omulimi.,A trader benefits more than the producer.,,,Both,,
ensoha,The clay pot keeps drinking water cool.,Ensoha erinda amaizi nigafuka.,Ensoha erinda amaizi nigafuka.,The clay pot keeps drinking water cool.,,,Both,,
omutungwa,People of Tooro and Bunyooro kingdom are subjects to the king.,Abantu ba tooro na bunyoro batungwa bumukama.,Abantu ba tooro na bunyoro batungwa bumukama.,People of Tooro and Bunyooro kingdom are subjects to the king.,,,Both,,
omufundi,In the whole sub county there is no any artisan.,Omugomborra yoona busamu mufundi noomu.,Omugomborra yoona busamu mufundi noomu.,In the whole sub county there is no any artisan.,,,Both,,
omuziro,Every clan in Tooro and Bunyoro has totem.,Mu Bunyoro na Tooro buli ruganda rugira omuziro gwarwo.,Mu Bunyoro na Tooro buli ruganda rugira omuziro gwarwo.,Every clan in Tooro and Bunyoro has totem.,,,Both,,
okwemerrahamu,thank you very much beloved for showing solidality to me during the wedding,mwehale abaruna kwemerrananyawe rabusenyi bwa mutabani,mwehale abaruna kwemerrananyawe rabusenyi bwa mutabani,thank you very much beloved for showing solidality to me during the wedding,,,Both,,
isemu,have a great deai of brother hood and call each other brother,abantu abajulirwe,abantu abajulirwe,have a great deai of brother hood and call each other brother,,,Both,,
nymemu,women in ourclan call themselves sisters,abakazi bomuruga ndarwaitu betangama nyinemu,abakazi bomuruga ndarwaitu betangama nyinemu,women in ourclan call themselves sisters,,,Both,,
kuganyira,I forgave him but he refused,nyowe nkamuganyirq baitu kuwe akanga,nyowe nkamuganyirq baitu kuwe akanga,I forgave him but he refused,,,Both,,
Ensimbi,Cowrie shells were used long ago.,Ensimbi zakozesebwaga ira.,Ensimbi zakozesebwaga ira.,Cowrie shells were used long ago.,,,Both,,
ekiganyiro,I apologies of not paying u in time,ninsaba ekigonyiro nkasobya kukererwa kuzasura,ninsaba ekigonyiro nkasobya kukererwa kuzasura,I apologies of not paying u in time,,,Both,,
ekiibo,One basket of beans is what was brought to church.,"Ekiibo kimu eky,ebihimba nikyo yalesire omukanisa.","Ekiibo kimu eky,ebihimba nikyo yalesire omukanisa.",One basket of beans is what was brought to church.,,,Both,,
omukago,daniel and john mede covenant not betray each other,danier ana john bomukago kand tibasobora kugobe zangana,danier ana john bomukago kand tibasobora kugobe zangana,daniel and john mede covenant not betray each other,,,Both,,
Omutungi wente,A farmer is always richer than the other villagers.,Omuntingi wente akira abagenzibe hakyaro eki.,Omuntingi wente akira abagenzibe hakyaro eki.,A farmer is always richer than the other villagers.,,,Both,,
Omusohi wencu,Jesus called 10 fishermen to follow him.,Yesu aketa abasohi bencu 10 okumuhondera.,Yesu aketa abasohi bencu 10 okumuhondera.,Jesus called 10 fishermen to follow him.,,,Both,,
emparane,in the contract agreement the builder agreed to finish the work in 3months,omwombeki okapatana kumara enju omu meezi anatu,omwombeki okapatana kumara enju omu meezi anatu,in the contract agreement the builder agreed to finish the work in 3months,,,Both,,
omuhesi,That man was the first blacksmith in our subcounty.,ogu omusaija nuwe yabaire omuhesi wokubaza omugomborra yaitu.,ogu omusaija nuwe yabaire omuhesi wokubaza omugomborra yaitu.,That man was the first blacksmith in our subcounty.,,,Both,,
ekyoto,This early morning the fire place was cold.,Nyenkyakaraenu ekyoto kibaire nikifuka.,Nyenkyakaraenu ekyoto kibaire nikifuka.,This early morning the fire place was cold.,,,Both,,
okutunga,Prosperity comes from working hard.,okutunga ebintu bingi kiruga mukukora namani.,okutunga ebintu bingi kiruga mukukora namani.,Prosperity comes from working hard.,,,Both,,
Ekitiniisa,Status comes from ones behaviour.,Ekitiniisa kiruga mungeso.,Ekitiniisa kiruga mungeso.,Status comes from ones behaviour.,,,Both,,
murangwa ibara,Prestige is a result of what one does.,omuntu ebyakora bumufoora murangwa ibara.,omuntu ebyakora bumufoora murangwa ibara.,Prestige is a result of what one does.,,,Both,,
ebicweka mubantu,class is brought by differences in money.,Ebicweka mubantu biretwa obutangaina musente.,Ebicweka mubantu biretwa obutangaina musente.,class is brought by differences in money.,,,Both,,
Amadaara mubantu,The castes in Tooro and bunyooro are the bairu and the bahuma.,Amadaara mubantu mu tooro na bunyooro gaba abairu nabahuma.,Amadaara mubantu mu tooro na bunyooro gaba abairu nabahuma.,The castes in Tooro and bunyooro are the bairu and the bahuma.,,,Both,,
obwenda,generosity is born can not be learnt,arwarwanabwo tasobora kubweye gesa,arwarwanabwo tasobora kubweye gesa,generosity is born can not be learnt,,,Both,,
obusigazi,Adolescence starts when a boy`s voice changes and in girls when they start monthly periods.,obusigazi butandika omwojo obwahindura iraka kandi omwisiki obwahendeka omugongo.,obusigazi butandika omwojo obwahindura iraka kandi omwisiki obwahendeka omugongo.,Adolescence starts when a boy`s voice changes and in girls when they start monthly periods.,,,Both,,
amananu,your people do things in truth,nywe abantu mukole ebintu omumananu,nywe abantu mukole ebintu omumananu,your people do things in truth,,,Both,,
Okumera Enza,"When one grows pubic hair, he/she is considered to be in the puberty stage.",Omwana obwamera enza abakuzire.,Omwana obwamera enza abakuzire.,"When one grows pubic hair, he/she is considered to be in the puberty stage.",,,Both,,
Kuruga Mubuto,"when a man reaches manhood, he is expected to marry.","omusaija obu arugamubuto, aswere.","omusaija obu arugamubuto, aswere.","when a man reaches manhood, he is expected to marry.",,,Both,,
kunihiza,you promised me a cow but i have come to collect it,okaniruza enter have come to correct,okaniruza enter have come to correct,you promised me a cow but i have come to collect it,,,Both,,
ezigati,You the grass from the school compound.,Ezigati yisomero mugitememu obunyansi.,Ezigati yisomero mugitememu obunyansi.,You the grass from the school compound.,,,Both,,
mukazi kukura,"When a woman experiences monthly periods, they have reached womanhood.",omwisiki obwahenka omugongo aba akuzire.,omwisiki obwahenka omugongo aba akuzire.,"When a woman experiences monthly periods, they have reached womanhood.",,,Both,,
omuhiigi,I am a child of a hunter.,Nyowe ndimwana wo muhiigi.,Nyowe ndimwana wo muhiigi.,I am a child of a hunter.,,,Both,,
Omusoromi,Men of long ago were gatherers.,Abasaija baira bali basoromi.,Abasaija baira bali basoromi.,Men of long ago were gatherers.,,,Both,,
enju y'ekisu,The hut house is warm.,Enju y'ekisu harumu kutagata.,Enju y'ekisu harumu kutagata.,The hut house is warm.,,,Both,,
omusubuzi rurangangwa,A merchant brings alot of stock in his shop.,omusubuzi rurangangwa aleta ebintu bingi muduka.,omusubuzi rurangangwa aleta ebintu bingi muduka.,A merchant brings alot of stock in his shop.,,,Both,,
kwegarurrana,After a while in conlict now we have reconciled,hanyumu yakasumi omunkungani hati tukegarurrana,hanyumu yakasumi omunkungani hati tukegarurrana,After a while in conlict now we have reconciled,,,Both,,
Akatale,Owiino is a big market.,Owino Kataale kakooto.,Owino Kataale kakooto.,Owiino is a big market.,,,Both,,
ekisisi,In Tooro and Bunyoro traditional beer is kept in the calabash.,Amaarwa ga Tooro ne Bunyoro bagalindira omubisisi.,Amaarwa ga Tooro ne Bunyoro bagalindira omubisisi.,In Tooro and Bunyoro traditional beer is kept in the calabash.,,,Both,,
kuhingisaniza,There was a lot of barter trade long ago.,hakaba haroho kuhingisaniza.,hakaba haroho kuhingisaniza.,There was a lot of barter trade long ago.,,,Both,,
Sente,The Ugandan currency is a shilling.,Sente za Uganda ziba siringi.,Sente za Uganda ziba siringi.,The Ugandan currency is a shilling.,,,Both,,
Ebyemwechakuro,"At the party, they danced to pop music.",Habugenyi bakazina ebiziina ebyemwechakuro.,Habugenyi bakazina ebiziina ebyemwechakuro.,"At the party, they danced to pop music.",,,Both,,
ekyaro,My village is called Kahundo.,Ekyaro ky'owaitu nikyo Kahundo.,Ekyaro ky'owaitu nikyo Kahundo.,My village is called Kahundo.,,,Both,,
Bigambo ruseyeya,People danced to his hip hop music.,Ebigambobye ruseyeya abantu bakabiziniraho.,Ebigambobye ruseyeya abantu bakabiziniraho.,People danced to his hip hop music.,,,Both,,
oburungi,"when we obey god,s commands we enjoy the earthy life",ubutuhurra ebiragiro bya ruhanga turya oburubgi bwensi.,ubutuhurra ebiragiro bya ruhanga turya oburubgi bwensi.,"when we obey god,s commands we enjoy the earthy life",,,Both,,
Abarongo,"Twins love each other when one falls sick, even the other falls sick.",Abarongo bazonzangana omu obwarwara nondi naawe arwara,Abarongo bazonzangana omu obwarwara nondi naawe arwara,"Twins love each other when one falls sick, even the other falls sick.",,,Both,,
Owibararyange,That person is my namesake.,Omuntu ogu twine ibara limu.,Omuntu ogu twine ibara limu.,That person is my namesake.,,,Both,,
Kuruka Ibara,"On the naming ceremony, there is eating and celebrating.","Hakiro kokuruka omwana ibara, habaho korya nokijaguza.","Hakiro kokuruka omwana ibara, habaho korya nokijaguza.","On the naming ceremony, there is eating and celebrating.",,,Both,,
obwingoniza,God is just,ruhanga oba mwinganiza,ruhanga oba mwinganiza,God is just,,,Both,,
kusarwa kwabakazi,Female genital mutilation is rare these days.,kusarwa kwabakazi tikukanya birobinu.,kusarwa kwabakazi tikukanya birobinu.,Female genital mutilation is rare these days.,,,Both,,
amakune,When the hospitable person dies heavy rain pours.,Omuntu owa makune obwafa enjura egwa.,Omuntu owa makune obwafa enjura egwa.,When the hospitable person dies heavy rain pours.,,,Both,,
omuruki,My grandma is a weaver.,Mukaka wange aba muruki.,Mukaka wange aba muruki.,My grandma is a weaver.,,,Both,,
endagano,i have done an agreement for my land,nyowe nyina endagano eyinagulirekeho stakab ryange,nyowe nyina endagano eyinagulirekeho stakab ryange,i have done an agreement for my land,,,Both,,
icumbiro,Our kitchen deserves a better a house.,Icumbiro ryaitu niryetagisa enju enungi.,Icumbiro ryaitu niryetagisa enju enungi.,Our kitchen deserves a better a house.,,,Both,,
Omubumbi,a perfect potter made my cups.,mubimbi murungi akabumba ebikopo byange.,mubimbi murungi akabumba ebikopo byange.,a perfect potter made my cups.,,,Both,,
amahiga,You will put on the fire place.,Otekeho ebyokurya hamahiga.,Otekeho ebyokurya hamahiga.,You will put on the fire place.,,,Both,,
Omuruki,My grandmother is a good basket maker.,Mukaka aba muruki murungi.,Mukaka aba muruki murungi.,My grandmother is a good basket maker.,,,Both,,
akakwataniza,He didn`t finish the song because he failed to get the bridge.,Ekiziina atakimaliire habwokuburwa akakwataniza.,Ekiziina atakimaliire habwokuburwa akakwataniza.,He didn`t finish the song because he failed to get the bridge.,,,Both,,
obumtu,"ethical standards ,propety followed makes a person a human",omuntu afooka muntu obwahandera ebiragiro byobuntu,omuntu afooka muntu obwahandera ebiragiro byobuntu,"ethical standards ,propety followed makes a person a human",,,Both,,
Entandiko,His song has a very brief intro.,Ekiziinakye kiine entandiko ngufu muno.,Ekiziinakye kiine entandiko ngufu muno.,His song has a very brief intro.,,,Both,,
kutamu ekitinisa,Greeting by a pet name is an expression of respect.,Kuramukya empaako kuba kutamungana ekitinisa.,Kuramukya empaako kuba kutamungana ekitinisa.,Greeting by a pet name is an expression of respect.,,,Both,,
Emaliira,The intro of the song is better than the outro.,Entandiko yekiziina esemiire kukira emaliira.,Entandiko yekiziina esemiire kukira emaliira.,The intro of the song is better than the outro.,,,Both,,
ekitinisa,The prime minister spoke very well.,Owekitinisa omuhikirwa abalize kurungi.,Owekitinisa omuhikirwa abalize kurungi.,The prime minister spoke very well.,,,Both,,
Ekiziina kyomuntu omu,He sang his song solo.,Ekiziina akakizzina wenka.,Ekiziina akakizzina wenka.,He sang his song solo.,,,Both,,
muhikirule,my father atenyi was a virtous man because he didnt fight against moral stanards.,atenyi isenyowe akaba ali muhikirire habwokubatiyakoraga ebyakalebule,atenyi isenyowe akaba ali muhikirire habwokubatiyakoraga ebyakalebule,my father atenyi was a virtous man because he didnt fight against moral stanards.,,,Both,,
okuswara,Speaking aimlessly makes one be ashamed.,Kubaza ebyakahoiho kiswaza.,Kubaza ebyakahoiho kiswaza.,Speaking aimlessly makes one be ashamed.,,,Both,,
Ky`enaku ruseyeya,That song is of R&B genre.,Eki ekizina Ky`enaku ruseyeya.,Eki ekizina Ky`enaku ruseyeya.,That song is of R&B genre.,,,Both,,
kuragaana,children of their baptism vowed to leaves satan and his acts,abaana bokubatizibwa bakaragana nibagamba okufuruka sitaaninenge zogezoona,abaana bokubatizibwa bakaragana nibagamba okufuruka sitaaninenge zogezoona,children of their baptism vowed to leaves satan and his acts,,,Both,,
Omuhuma,A patrolist`s property are the cows.,Omuhuma ekibanjakye nizo ente.,Omuhuma ekibanjakye nizo ente.,A patrolist`s property are the cows.,,,Both,,
Ekinyumyo,There were so many people at the concert we didn`t even see what was at the front.,Abantu bakaba baingi hakinyumyo obyyomumaiso tutabihweze.,Abantu bakaba baingi hakinyumyo obyyomumaiso tutabihweze.,There were so many people at the concert we didn`t even see what was at the front.,,,Both,,
obugwagwa,the son of the neighbour is a vice in our village,mutabani wa nanka aba kigwagwa,mutabani wa nanka aba kigwagwa,the son of the neighbour is a vice in our village,,,Both,,
Ekiziina kyenaku,The orphans sang blues music.,Enfuzi zikazina ekiziina kyenaku.,Enfuzi zikazina ekiziina kyenaku.,The orphans sang blues music.,,,Both,,
abaikazi,The community of Sir Tito Winy School love each other.,Abaikazi bomwisomero rya Sir Tito Winy bagonzangana.,Abaikazi bomwisomero rya Sir Tito Winy bagonzangana.,The community of Sir Tito Winy School love each other.,,,Both,,
okutimba,Decorate the house with flowers so that it looks adorned.,Timba ebyakyo enju esemere.,Timba ebyakyo enju esemere.,Decorate the house with flowers so that it looks adorned.,,,Both,,
engndo,Long ago women used to do tattoos on their faces.,Abakazi abaira bayesaraga engondo hamaiso.,Abakazi abaira bayesaraga engondo hamaiso.,Long ago women used to do tattoos on their faces.,,,Both,,
Ebiziina byensi,Every country sang world music at the music festival.,"Hamwoleko gw`ebizina, ensi zoona zikazina ebizina byensi.","Hamwoleko gw`ebizina, ensi zoona zikazina ebizina byensi.",Every country sang world music at the music festival.,,,Both,,
Ebiziina byabarukwiragura,It`s shocking that American people love African music.,Nikihuniriza abajungu bagonza ebiziina byabarukwiragura.,Nikihuniriza abajungu bagonza ebiziina byabarukwiragura.,It`s shocking that American people love African music.,,,Both,,
kutona,At the rituals of milking princesses on duty paint their faces.,Ababiitokati betona hamurwa gw'okukorooga.,Ababiitokati betona hamurwa gw'okukorooga.,At the rituals of milking princesses on duty paint their faces.,,,Both,,
ebizina katogo,school going children love afrobeat music.,Abana bamasomero bagonza ebizina katogo.,Abana bamasomero bagonza ebizina katogo.,school going children love afrobeat music.,,,Both,,
kusiba isoke,My wife doesn't wish weaving her hair.,Mukazi wange tagonza kusiba isoke.,Mukazi wange tagonza kusiba isoke.,My wife doesn't wish weaving her hair.,,,Both,,
Ekitabule,A lot of music lately has highlife in it.,Ebizina byabirobinu birumu ekitabule kingi.,Ebizina byabirobinu birumu ekitabule kingi.,A lot of music lately has highlife in it.,,,Both,,
Enoota,It's easy to teach them the notes.,Enoota z`ekizina zanguhire kukibeegesa,Enoota z`ekizina zanguhire kukibeegesa,It's easy to teach them the notes.,,,Both,,
ekyanda petegecu,During drought no seeds can germinate and survive.,omu kyanda peregecu tibabyaramu mbibo .,omu kyanda peregecu tibabyaramu mbibo .,During drought no seeds can germinate and survive.,,,Both,,
G`ebidongo Kayoora,Soukous like for congo.,Amazina G`ebidongo Kayoora nkaga Congo.,Amazina G`ebidongo Kayoora nkaga Congo.,Soukous like for congo.,,,Both,,
enyikiriza,My belief is in the almighty God who created me and the universe.,enyikiriza yange niyo eya ruhanga omu ayahangire nyowe nebintu byona.,enyikiriza yange niyo eya ruhanga omu ayahangire nyowe nebintu byona.,My belief is in the almighty God who created me and the universe.,,,Both,,
okuramukya,Good morning Ateenyi.,Oraire ota Ateenyi.,Oraire ota Ateenyi.,Good morning Ateenyi.,,,Both,,
Ekigarukwaamu,Their song was lengthened by the chorus.,Ekiziina kyabo kikaraihibwa ekigarukwaamu.,Ekiziina kyabo kikaraihibwa ekigarukwaamu.,Their song was lengthened by the chorus.,,,Both,,
engemonungi,morality causes a person high honour in the society,engenso enungi zikuha ekitinisa omubantu,engenso enungi zikuha ekitinisa omubantu,morality causes a person high honour in the society,,,Both,,
engeso,It is a rule that even male also kneel for their elders.,Abasaija nabo batereeza amaju abakuru.,Abasaija nabo batereeza amaju abakuru.,It is a rule that even male also kneel for their elders.,,,Both,,
kumoma,The disease has caused theleaves of the tree to be rusty.,oburwaire bumomeseze amababi gomuti,oburwaire bumomeseze amababi gomuti,The disease has caused theleaves of the tree to be rusty.,,,Both,,
Idaara ry`e erikooto,The young ones were made to sing the major scale.,Abato bakabazinisa enoota z`idara erikooto.,Abato bakabazinisa enoota z`idara erikooto.,The young ones were made to sing the major scale.,,,Both,,
Idaara erike,The minor tones sound sorrowful.,Idaara erike ligira amaraka g`obujune.,Idaara erike ligira amaraka g`obujune.,The minor tones sound sorrowful.,,,Both,,
kahoita,He masked himself so that he shouldn't be identified.,Ayeswekeriize kahoita nukwo batamumanya.,Ayeswekeriize kahoita nukwo batamumanya.,He masked himself so that he shouldn't be identified.,,,Both,,
Orukaara Rwe`kiziina,The couldn`t sing the song because they didn`t know the verse.,Ekizina kikabalema habwokutamanya orukaara rwekizina.,Ekizina kikabalema habwokutamanya orukaara rwekizina.,The couldn`t sing the song because they didn`t know the verse.,,,Both,,
Bigambo kuseyaya,People dance to rap music.,Bigambo ebikuseyaya abantu babiziniraho.,Bigambo ebikuseyaya abantu babiziniraho.,People dance to rap music.,,,Both,,
orweezo,animal dung used as fertilizer.,obusa bwebisoro burugwa muorwezo,obusa bwebisoro burugwa muorwezo,animal dung used as fertilizer.,,,Both,,
kukanyisa,They have added fertilizers in the soil to make it more productive,omu itaka bongizeemu orweeza ebyokurya nibiija kwama kurungi.,omu itaka bongizeemu orweeza ebyokurya nibiija kwama kurungi.,They have added fertilizers in the soil to make it more productive,,,Both,,
Engoma kaleeta maraka,People of Eastern Uganda play entenga.,Aba burugaizooba Uganda bakozesa muno engoma zentega,Aba burugaizooba Uganda bakozesa muno engoma zentega,People of Eastern Uganda play entenga.,,,Both,,
orweezo rwomubirimwa,we also get fertilizer from plants,omu birimwa naho harugamu orweeza,omu birimwa naho harugamu orweeza,we also get fertilizer from plants,,,Both,,
ebikwato,Every king has his own regalia and part of it is is buried with it.,Omukama weena aba nebikwatobyekandi ebimu bamutabazanabyo.,Omukama weena aba nebikwatobyekandi ebimu bamutabazanabyo.,Every king has his own regalia and part of it is is buried with it.,,,Both,,
kizina ncwamutima,The wife sang for him soul music.,mukaziwe akamuziinira ebizina ncwamutima.,mukaziwe akamuziinira ebizina ncwamutima.,The wife sang for him soul music.,,,Both,,
Ebiziina b`yediini,Gospel songs make me very happy.,Ebiziina b`yediini binsemeza muno.,Ebiziina b`yediini binsemeza muno.,Gospel songs make me very happy.,,,Both,,
Ebiziina rwekicumbi,Country music is often loved by old people.,Ebiziina rwekicumbi bikira kugonzebwa abantu bakuru.,Ebiziina rwekicumbi bikira kugonzebwa abantu bakuru.,Country music is often loved by old people.,,,Both,,
ebikomo,Wearing beads on both hands and indicates the married woman.,Ebikomo bijwara abakazi nibehundakazooke kurungi.,Ebikomo bijwara abakazi nibehundakazooke kurungi.,Wearing beads on both hands and indicates the married woman.,,,Both,,
Ebiziina byenzarwa,The school children sang folk songs.,Abana bisomere bakazina ebiziina byenzarwa.,Abana bisomere bakazina ebiziina byenzarwa.,The school children sang folk songs.,,,Both,,
Enoota ezirukwikiirraruliza,The notes of their song were discordant.,Enoota zekizina kyaabo tizibaire zirungi mumatu.,Enoota zekizina kyaabo tizibaire zirungi mumatu.,The notes of their song were discordant.,,,Both,,
oruganikyo,"In the beginning there was Hangi who produced Kakama, Kahuma and Kairu.","Hakubanza kwensi hakaba aroho Hangi yazara Kakama, Kahuma na Kairu.","Hakubanza kwensi hakaba aroho Hangi yazara Kakama, Kahuma na Kairu.","In the beginning there was Hangi who produced Kakama, Kahuma and Kairu.",,,Both,,
amadinda g`omulinga,people love the Vibraphone because of its sustaining effect.,Abantu bagoza amadinda g`omulinga habwokuikazayo iraka.,Abantu bagoza amadinda g`omulinga habwokuikazayo iraka.,people love the Vibraphone because of its sustaining effect.,,,Both,,
empunu yomukisaka,It is awild animal which spoils crops especially cassava and potatoes,empunu kisoro kyomukisaka kikira muno kurya nokusisa ebyokurya nka muhogo nebitakuli,empunu kisoro kyomukisaka kikira muno kurya nokusisa ebyokurya nka muhogo nebitakuli,It is awild animal which spoils crops especially cassava and potatoes,,,Both,,
Enanga nyabwooma,the pitch of the glockenspiel is high and clear.,iraka rye enanga nyabwooma liba haiguru kandi litereekereiire.,iraka rye enanga nyabwooma liba haiguru kandi litereekereiire.,the pitch of the glockenspiel is high and clear.,,,Both,,
Akooma Nyansonda,He held the Triangle by a string while playing it.,omuteezi wa akooma nyansonda akakata mukagoye kasusuba.,omuteezi wa akooma nyansonda akakata mukagoye kasusuba.,He held the Triangle by a string while playing it.,,,Both,,
