word,definitionEnglish,definitionNative,exampleSentence1,exampleSentence1English,exampleSentence2,exampleSentence2English,dialect,pos,domain
mukaaka,My grandma cooks very sweet food.,Mukaaka acumba ebyokurya birukunura muno.,Mukaaka acumba ebyokurya birukunura muno.,My grandma cooks very sweet food.,,,Both,,
Kamarabyona,God is omnipotent for He does all things.,Kamarabyona nuwe Ruhanga anyakutukorra byona.,Kamarabyona nuwe Ruhanga anyakutukorra byona.,God is omnipotent for He does all things.,,,Both,,
katenkuru,My grandpa has so many friends.,Katenkuru aine abanywani baingi muno.,Katenkuru aine abanywani baingi muno.,My grandpa has so many friends.,,,Both,,
bamiya,Okra is a vegetable crop grown by farmers for its green edible pods.,Bamiya kitimwa bakirya nka eteke obujuma babuihama kawa.,Bamiya kitimwa bakirya nka eteke obujuma babuihama kawa.,Okra is a vegetable crop grown by farmers for its green edible pods.,,,Both,,
isenkuru,My grandfather is very clever.,Isenkuru nyowe aine amagezi maingi.,Isenkuru nyowe aine amagezi maingi.,My grandfather is very clever.,,,Both,,
Kukebera,His dad was asked for a urine sample so that the diagnosis could start.,Use bakamusaba ekiseso nukw’okukebera kutandika.,Use bakamusaba ekiseso nukw’okukebera kutandika.,His dad was asked for a urine sample so that the diagnosis could start.,,,Both,,
nkaha?,Where is the party?,Obugenyi buli nkaha?,Obugenyi buli nkaha?,Where is the party?,,,Both,,
kiki?,What are you doing?,Kiki ekyorukurora?,Kiki ekyorukurora?,What are you doing?,,,Both,,
noha?,Who is coming tomorrow?,Noha arukwija nyenkya?,Noha arukwija nyenkya?,Who is coming tomorrow?,,,Both,,
biringanyi,It is a fruit used as a vegetable and is used in cooking when cooked it becomes soft and absorbs flavours from other foods.,"Ebiringaanyi/mukubi ogurukworoba guba gwerangi ya kakobe hakisusu,babicumba kandi babirya nka ebyokurya.","Ebiringaanyi/mukubi ogurukworoba guba gwerangi ya kakobe hakisusu,babicumba kandi babirya nka ebyokurya.",It is a fruit used as a vegetable and is used in cooking when cooked it becomes soft and absorbs flavours from other foods.,,,Both,,
kiki eki,What is that in your hand?,Kiki eki mumukono gwawe?,Kiki eki mumukono gwawe?,What is that in your hand?,,,Both,,
ruhakaniza kizaani,the antagonist kept a good contrast with protoganist thus keeping people curious,"ruhakaniza kizooniakaleetaho obutaikirraza nakizaani, abantu baagira ekihika","ruhakaniza kizooniakaleetaho obutaikirraza nakizaani, abantu baagira ekihika",the antagonist kept a good contrast with protoganist thus keeping people curious,,,Both,,
Kuhendeka,The child got a fracture while playing footballs,Omwana ahendendekere nazana omupiira,Omwana ahendendekere nazana omupiira,The child got a fracture while playing footballs,,,Both,,
omwehanga hangi,He used alot of imagination in his creative work.,"Akateekereza muno ,nk'omwehangahangi ,nukwo yaihamu ekintu.","Akateekereza muno ,nk'omwehangahangi ,nukwo yaihamu ekintu.",He used alot of imagination in his creative work.,,,Both,,
Ekisarasaizi,He does exercise after work.,Buli kwinuka ha mulimo akora ekisarasaize.,Buli kwinuka ha mulimo akora ekisarasaize.,He does exercise after work.,,,Both,,
Kwecencura oburwaire,Prognosis helps to understand the actual cause of the disease.,O’ kwecencura oburwaiale kikonyera kumanya oburwaire bulesirweki.,O’ kwecencura oburwaiale kikonyera kumanya oburwaire bulesirweki.,Prognosis helps to understand the actual cause of the disease.,,,Both,,
Omusiitale,She drew a straight line across the paper.,Akateera omusitale kuruga ensonda nensonda y’orupapuro.,Akateera omusitale kuruga ensonda nensonda y’orupapuro.,She drew a straight line across the paper.,,,Both,,
Enyombeka (yekihangahangirwe),The vase has a round form.,Ekibumbirwe ky’ebyaakyo kiina enyombeka eyekulingiriire.,Ekibumbirwe ky’ebyaakyo kiina enyombeka eyekulingiriire.,The vase has a round form.,,,Both,,
irindiro ryebitabu,he was not allowed to borrow any book until she returns what she had borrrowed,batamwikerize kutiiza ebitabu bindi habindi habwokuba ebiyali atwaigarwirere akaba atakobi,batamwikerize kutiiza ebitabu bindi habindi habwokuba ebiyali atwaigarwirere akaba atakobi,he was not allowed to borrow any book until she returns what she had borrrowed,,,Both,,
Omupakasa,The worker completed the job in time.,Omupakasa amazire omulimo mu bwire.,Omupakasa amazire omulimo mu bwire.,The worker completed the job in time.,,,Both,,
Omuze,Addiction,Omuhama,,,,,Mixed,N,NAR
oburo,"Millet cake is eaten mostly on important functions like wedding, and feasting of all kinds in Tooro and Bunyoro. It is an important cultural crop.",Oburo babulima Bunyoro na Tooro kandi kiba kyokurya habuli mukoro gwona.,Oburo babulima Bunyoro na Tooro kandi kiba kyokurya habuli mukoro gwona.,"Millet cake is eaten mostly on important functions like wedding, and feasting of all kinds in Tooro and Bunyoro. It is an important cultural crop.",,,Both,,
ebyokuhuni nza,"the magician,s trick was a mystery to the audience",amagezi gowanasano gakahuniriza muno abasungi,amagezi gowanasano gakahuniriza muno abasungi,"the magician,s trick was a mystery to the audience",,,Both,,
Ensisana,Sand paper has a coarse texture.,Ekipapura ruteza kiina ensisana erukuteera.,Ekipapura ruteza kiina ensisana erukuteera.,Sand paper has a coarse texture.,,,Both,,
Ekijuma nyamaizi,"A large ,juicy fruit that has alot of water inside and is usually eaten fresh is called water melon.","Ekijuma nyamaizi kyekurringire nka ihuli ,kikoota kinyina amaizi maingi omunda kandi kandibakirya kibisi.","Ekijuma nyamaizi kyekurringire nka ihuli ,kikoota kinyina amaizi maingi omunda kandi kandibakirya kibisi.","A large ,juicy fruit that has alot of water inside and is usually eaten fresh is called water melon.",,,Both,,
omusemeza w'ebihangirwe,our teacher is very artistic,omusomesa waitu aina amagezi g'okusemesa ekihangirwe.,omusomesa waitu aina amagezi g'okusemesa ekihangirwe.,our teacher is very artistic,,,Both,,
omuzaano gwaharutuuti kasekesa,the laughters of the audience created noise in the hall,omuzaano gusekezese abantu haijamu n'etoko,omuzaano gusekezese abantu haijamu n'etoko,the laughters of the audience created noise in the hall,,,Both,,
Obujanjabi,He recommended the best treatment and the patient recovered very fast.,Akaragiira obujanjabi obuhikire yakira bwangu.,Akaragiira obujanjabi obuhikire yakira bwangu.,He recommended the best treatment and the patient recovered very fast.,,,Both,,
omuceeri,"Rice is mostly grown in Eastern world countries like china, India AND Japan. It is both a cash and food crop.",Omuceeri kyokurya ekyenjuma ekikinyakubyarwa omukikaro ekine amaizi maingi.,Omuceeri kyokurya ekyenjuma ekikinyakubyarwa omukikaro ekine amaizi maingi.,"Rice is mostly grown in Eastern world countries like china, India AND Japan. It is both a cash and food crop.",,,Both,,
Eduuka y'emibazi,The doctor told him to get medicine from the pharmacy.,Omufumu akamugambira agende atunge omubazi kuruga ha duuka y'emibazi.,Omufumu akamugambira agende atunge omubazi kuruga ha duuka y'emibazi.,The doctor told him to get medicine from the pharmacy.,,,Both,,
Omucwezi,"In bunyoro and Tooro, the Bacwezi are deity.",Omucwezi weena amanywa nkomukozi webyokuhuniriza omu Bunyoro na Tooro.,Omucwezi weena amanywa nkomukozi webyokuhuniriza omu Bunyoro na Tooro.,"In bunyoro and Tooro, the Bacwezi are deity.",,,Both,,
Kirinika,They took asick child to the clinic,Batwairenge omwana omurwaire ha kirinika.,Batwairenge omwana omurwaire ha kirinika.,They took asick child to the clinic,,,Both,,
Arukwehangahanga,A musician is also an Artist because he creates music.,Omuzini muntu arukwehangahanga habwokuba acwereera.,Omuzini muntu arukwehangahanga habwokuba acwereera.,A musician is also an Artist because he creates music.,,,Both,,
Irwarro,The hospital is near our house.,Irwarro liri haihi nenju yaitu.,Irwarro liri haihi nenju yaitu.,The hospital is near our house.,,,Both,,
okwehanga hanga,Art allows people to express their feelings and creativity.,okwehangahanga kukonyera abantu kwoleka ebitekerezo byaabo.,okwehangahanga kukonyera abantu kwoleka ebitekerezo byaabo.,Art allows people to express their feelings and creativity.,,,Both,,
Mukunzikati,My brother's girlfriend is very kind.,Mukunzikati wa munyanya nyowe aine embabazi nyingi.,Mukunzikati wa munyanya nyowe aine embabazi nyingi.,My brother's girlfriend is very kind.,,,Both,,
Obwomeezi,I have spent 5 years with good health.,Mazire emwaka etaano nyine obwomezi burungi.,Mazire emwaka etaano nyine obwomezi burungi.,I have spent 5 years with good health.,,,Both,,
"omukoonyezi w,enyuma y'orutuuti",a skilled stage hand keeps everything running on time,"omukoonyezi w'enyuma y,orurutuuti omurungi atwaara omuzaano mumaiso kandi mubwire bwaagwa","omukoonyezi w'enyuma y,orurutuuti omurungi atwaara omuzaano mumaiso kandi mubwire bwaagwa",a skilled stage hand keeps everything running on time,,,Both,,
Mukunzi,Her boyfriend came to help her on the event.,Mukunzi we akaija kumukonyera habugenyi.,Mukunzi we akaija kumukonyera habugenyi.,Her boyfriend came to help her on the event.,,,Both,,
Wobusobozi bwona,God is the Almighty.,Ruhanga niwe aba wobusobozi bwona.,Ruhanga niwe aba wobusobozi bwona.,God is the Almighty.,,,Both,,
Omugonzibwa,My partner helps me with home work.,Omugonzibwa ankonyera ha mirimo y'omuka.,Omugonzibwa ankonyera ha mirimo y'omuka.,My partner helps me with home work.,,,Both,,
Obuceke,Illness makes one very weak.,Obuceke nibumara amani.,Obuceke nibumara amani.,Illness makes one very weak.,,,Both,,
Nyinento/ Isenkati,My Aunt has adevised me to buy land.,Nyinento nyowe ampaire amagezi kugura Itaka.,Nyinento nyowe ampaire amagezi kugura Itaka.,My Aunt has adevised me to buy land.,,,Both,,
endugiiro y'omuzaanon'esaaha,"the stage set had trees ,rocks and cows","endugiiro y,omuzaano ekooleka emith emyandara hamu n'ente","endugiiro y,omuzaano ekooleka emith emyandara hamu n'ente","the stage set had trees ,rocks and cows",,,Both,,
embibo,The small hard seed of the cereal plant are called grains.,Embibo ziruga omubirimwa ebyenjuma.,Embibo ziruga omubirimwa ebyenjuma.,The small hard seed of the cereal plant are called grains.,,,Both,,
Nyenkya,I want to finish this work tomorrow.,Ningonza kumara omulimo gunu nyekya.,Ningonza kumara omulimo gunu nyekya.,I want to finish this work tomorrow.,,,Both,,
by'okuguza,The government of Uganda is encouraging farmers to increase growing crops from where they can earn income.,Gavumenti ya Uganda neyekambisa abalimi na abaliisa kukanyisa ebirimwa ebyokutunda.,Gavumenti ya Uganda neyekambisa abalimi na abaliisa kukanyisa ebirimwa ebyokutunda.,The government of Uganda is encouraging farmers to increase growing crops from where they can earn income.,,,Both,,
Abobumu mukwehangahanga.,The art movement made a very big thing.,Abobumu mukwehangahanga bakoziire ekintu kikoto.,Abobumu mukwehangahanga bakoziire ekintu kikoto.,The art movement made a very big thing.,,,Both,,
Ebyomwoyo,Mr.Munaku studed Divinity.,Munaku akasoma amasomo ag'ebyomiwoyo.,Munaku akasoma amasomo ag'ebyomiwoyo.,Mr.Munaku studed Divinity.,,,Both,,
ebyokorozesa mumuzaano,the tables and the chairs were important props for the dining scene,entebe n'emeeza bintu bikuru ebyokukozesa mu muzaano habwe'kicweeka kyemeeza,entebe n'emeeza bintu bikuru ebyokukozesa mu muzaano habwe'kicweeka kyemeeza,the tables and the chairs were important props for the dining scene,,,Both,,
kucikababiri,"when they continued their dialogue ,the audience listened attentively",abaire nabaza nabagenzibe abantu baculeera kuhuliriza,abaire nabaza nabagenzibe abantu baculeera kuhuliriza,"when they continued their dialogue ,the audience listened attentively",,,Both,,
otisi,Oats is a cereal grain crop mostly used for porridge and animal feeds.,Ekirimwa kya otisi nakyo kyensi za aheeru nikisisa nka bale kyenjuma. Enjuma ba isa baihamu obusera neby'okurya by'ebisoro.,Ekirimwa kya otisi nakyo kyensi za aheeru nikisisa nka bale kyenjuma. Enjuma ba isa baihamu obusera neby'okurya by'ebisoro.,Oats is a cereal grain crop mostly used for porridge and animal feeds.,,,Both,,
oburorwaho,they used symbolism to represent different things,bakakogesa oburo rwaho kwoleka ebintu ebitaliu bimu,bakakogesa oburo rwaho kwoleka ebintu ebitaliu bimu,they used symbolism to represent different things,,,Both,,
Ebyafaayo by’okwehangahanga,He is studying Art History.,Nasoma Ebyafaayo by’okwehangahanga.,Nasoma Ebyafaayo by’okwehangahanga.,He is studying Art History.,,,Both,,
Abaigara,The Abaigara people dont disturb others .,Abaigara bantu tibatalibaniza bagenzi baabo.,Abaigara bantu tibatalibaniza bagenzi baabo.,The Abaigara people dont disturb others .,,,Both,,
Ensisana y’okugenda,The lines were showing the movement.,Emisitale ekaba neyoleka ensisana y’okugenda.,Emisitale ekaba neyoleka ensisana y’okugenda.,The lines were showing the movement.,,,Both,,
Ensorongya.,Bright colors add rhythm to artwork.,Range ezirukwaka zoongeraho ensorongya ha mulimo gw’omwehangahangi.,Range ezirukwaka zoongeraho ensorongya ha mulimo gw’omwehangahangi.,Bright colors add rhythm to artwork.,,,Both,,
Mwijukuru omwisiki,My Granddaughter stays with me.,Mwijukuru wange omwisiki aikara nanyowe.,Mwijukuru wange omwisiki aikara nanyowe.,My Granddaughter stays with me.,,,Both,,
ebicooli,Maize is an important crop in the country. It is grown for food and as a cash crop to get money.,Ebicooli kirimwa kikuru muno omu ihanga kandi kirimwa habwebyokurya nokutunda kutungamu sente.,Ebicooli kirimwa kikuru muno omu ihanga kandi kirimwa habwebyokurya nokutunda kutungamu sente.,Maize is an important crop in the country. It is grown for food and as a cash crop to get money.,,,Both,,
Nyineju,My uncle and his wife stay in the village.,Nyinarumi nyowe namukazi we baikara mukyaro.,Nyinarumi nyowe namukazi we baikara mukyaro.,My uncle and his wife stay in the village.,,,Both,,
Kuhwita,When you grow old you become weak.,"Obwomara kuhwita, amaani gakuhwa.","Obwomara kuhwita, amaani gakuhwa.",When you grow old you become weak.,,,Both,,
Ibara ry'enzarwa,My last name is Bakasara.,Ibara ryenzarwa Ninyowe Bakasara.,Ibara ryenzarwa Ninyowe Bakasara.,My last name is Bakasara.,,,Both,,
ekigendererwa kyo,the theme of the play was not evident at the end,ekigenderwa omuzaano gwabo hakimaliirra,ekigenderwa omuzaano gwabo hakimaliirra,the theme of the play was not evident at the end,,,Both,,
Ibara ry'okubaza,My first name is Rose.,Ibara ryange Ninyowe Rose.,Ibara ryange Ninyowe Rose.,My first name is Rose.,,,Both,,
Abaisanze,The Abaisanze are guards of the seat of the king of Tooro.,Abaisanze balinda Ekitebe kyomukama wa Tooro.,Abaisanze balinda Ekitebe kyomukama wa Tooro.,The Abaisanze are guards of the seat of the king of Tooro.,,,Both,,
ABAISIKATWE,The Abaisikatwe are few people scattered hear and there in Bunyooro and Tooro.,Abaisikatwe bantu bake muno baikara benagire hanuna kali Bunyooro na Tooro.,Abaisikatwe bantu bake muno baikara benagire hanuna kali Bunyooro na Tooro.,The Abaisikatwe are few people scattered hear and there in Bunyooro and Tooro.,,,Both,,
Orugendo,The trip was very long but exciting.,Orugendo rukaba ruraihire baitu nirukyanganura.,Orugendo rukaba ruraihire baitu nirukyanganura.,The trip was very long but exciting.,,,Both,,
ebirukubaho mumuzaano,the play pl;ot was sequecial up tothe end,ebyabaireho mu muzaano bikakurtana kurungi,ebyabaireho mu muzaano bikakurtana kurungi,the play pl;ot was sequecial up tothe end,,,Both,,
omwetekaniza webi jwaaro mumuzaano,the costume designer crated relevant costumes for the actors,omutekaruza w'ebijwaro akakora ebijwaaro ebirukugenderaha muzaano,omutekaruza w'ebijwaro akakora ebijwaaro ebirukugenderaha muzaano,the costume designer crated relevant costumes for the actors,,,Both,,
Omubazi katangira buhuka.,Clean the wound with antiseptic to prevent it from infection.,Ekihooya okinaabye n’omubazi katangira buhuka.,Ekihooya okinaabye n’omubazi katangira buhuka.,Clean the wound with antiseptic to prevent it from infection.,,,Both,,
omwtekaruza webyamataara,the lighting designer adjusted the colours to match the sunset,omuteekaniza wamataara akainganiza etaara nukwo zooleke ekisoonabazaana,omuteekaniza wamataara akainganiza etaara nukwo zooleke ekisoonabazaana,the lighting designer adjusted the colours to match the sunset,,,Both,,
Akabazi kogya.,Jane bought a disinfectant to clean her house.,Jane aguzire akabazi kogya kusiimura enju.,Jane aguzire akabazi kogya kusiimura enju.,Jane bought a disinfectant to clean her house.,,,Both,,
crop grown for food,Some farmers in the country grow mostly food crops and that is why they are being encouraged to grow cash crops to enter the cash econy.,Abalimi b'omubyaro abarukukira obwingi balima ebyokurya .,Abalimi b'omubyaro abarukukira obwingi balima ebyokurya .,Some farmers in the country grow mostly food crops and that is why they are being encouraged to grow cash crops to enter the cash econy.,,,Both,,
Hangi,Hangi is the father of Ruhanga in the power of Hangi Ruhanga does all things.,Hangi niwe Ise Ruhanga kandi mubusobozi bwa Hangi nuho Ruhanga akorra emiri moyo.,Hangi niwe Ise Ruhanga kandi mubusobozi bwa Hangi nuho Ruhanga akorra emiri moyo.,Hangi is the father of Ruhanga in the power of Hangi Ruhanga does all things.,,,Both,,
Ekihulirizo.,The stethoscope was placed on the old woman and the heart was pumping very fast.,Omukaikuru bamutaireho ekihulirizo basanga omutiima nitugera muno.,Omukaikuru bamutaireho ekihulirizo basanga omutiima nitugera muno.,The stethoscope was placed on the old woman and the heart was pumping very fast.,,,Both,,
amaraka g'okumanyisa,the movie used sound effects of thunder during the performance,abebisisani bya sineema bakakozesa amaraka g'okumanyisa enkuba omuzaano,abebisisani bya sineema bakakozesa amaraka g'okumanyisa enkuba omuzaano,the movie used sound effects of thunder during the performance,,,Both,,
akagambiso,"the singer,s microphone was connected to the amplifier",akagambiso kabazini bakakakwataruza na rwongeza iraka,akagambiso kabazini bakakakwataruza na rwongeza iraka,"the singer,s microphone was connected to the amplifier",,,Both,,
omujenjeezi,"Nomads move from one place to another looking for food, water, and pasture for their livelihood.","Abantu abataikara omukikaro kimu, baikara nibajenjeera hanu nahali.","Abantu abataikara omukikaro kimu, baikara nibajenjeera hanu nahali.","Nomads move from one place to another looking for food, water, and pasture for their livelihood.",,,Both,,
Oruhumuro,She stayed at home during the holiday.,Oruhumuro akarumarra omuka.,Oruhumuro akarumarra omuka.,She stayed at home during the holiday.,,,Both,,
omutekaniza webyamaraka,the sound designer added thunder and wind sounds in the play,"omutekaniza w'e byamaraka akoongeramu ery'e nkuba, n'eryomuya","omutekaniza w'e byamaraka akoongeramu ery'e nkuba, n'eryomuya",the sound designer added thunder and wind sounds in the play,,,Both,,
Kyamukaga na sabbiti,I will go to visit my grandmother on saturday and sunday.,Ningenda kurora mukaka kiro kyamukaga na sabbiti.,Ningenda kurora mukaka kiro kyamukaga na sabbiti.,I will go to visit my grandmother on saturday and sunday.,,,Both,,
Hambeho,I got the information from the social net work.,Ntungirege amakuru kuruga hambeho.,Ntungirege amakuru kuruga hambeho.,I got the information from the social net work.,,,Both,,
ekibarukukira kurya,Bananas are staple crops grown grown and eaten in Buganda and most parts of western Uganda and millet are staple crops in eastern and northern Uganda.,Ebyokurya abantu bomu kikaro bakira muno kurya.,Ebyokurya abantu bomu kikaro bakira muno kurya.,Bananas are staple crops grown grown and eaten in Buganda and most parts of western Uganda and millet are staple crops in eastern and northern Uganda.,,,Both,,
Orupimo rwobutagasi,The thermometer showered that her temperature was so high.,Orupimo rwobutagasi rwolekere ngu aine nayokya muno.,Orupimo rwobutagasi rwolekere ngu aine nayokya muno.,The thermometer showered that her temperature was so high.,,,Both,,
Obutumwa,I set you an email on phone,Nkusindikire obutumwa ha simu.,Nkusindikire obutumwa ha simu.,I set you an email on phone,,,Both,,
Ibara,Her name is Rose.,Ibara rye nuwe Rose.,Ibara rye nuwe Rose.,Her name is Rose.,,,Both,,
omwehangahangi w'ebyokwesemeza,the make upartist used bright colours to make the character stand out,"omwehryomungahangi w'ebyokwesemeza, akoongera ery,enkuba n'eryomuya","omwehryomungahangi w'ebyokwesemeza, akoongera ery,enkuba n'eryomuya",the make upartist used bright colours to make the character stand out,,,Both,,
Abaitira,Abaitira are cattle keepers from the past .,Abaitira bahuma kuruga kara baalinibalinda Ente nyingi.,Abaitira bahuma kuruga kara baalinibalinda Ente nyingi.,Abaitira are cattle keepers from the past .,,,Both,,
Kyakabiri,I go to the farm on every Tuesday.,Buli kyakabiri ngenda mwirisizo.,Buli kyakabiri ngenda mwirisizo.,I go to the farm on every Tuesday.,,,Both,,
Baraza,I go to dig on every Monday.,Ngenda kulima buli Baraza.,Ngenda kulima buli Baraza.,I go to dig on every Monday.,,,Both,,
Omucencuzi,The art critic is very tough.,Omucencuzi agumire muno.,Omucencuzi agumire muno.,The art critic is very tough.,,,Both,,
Omwaka,They are twelve months in a year.,Omwaka gurumu emyezi Ikumi nebiri.,Omwaka gurumu emyezi Ikumi nebiri.,They are twelve months in a year.,,,Both,,
Kurambura omwoleko,"During the vernissage, the guest of honor requested that the items be increased.","Omukurambura omwoleko, omugenyi mukuru akasaba ebintu byongerweho.","Omukurambura omwoleko, omugenyi mukuru akasaba ebintu byongerweho.","During the vernissage, the guest of honor requested that the items be increased.",,,Both,,
ebyenjuma,Cereals are grown for their grains which are energy giving foods ie carbohydrates.,Ebyokurya ebyenjuma bitungisa amaani.,Ebyokurya ebyenjuma bitungisa amaani.,Cereals are grown for their grains which are energy giving foods ie carbohydrates.,,,Both,,
Omukozi,Every employee must follow the company rules.,Omukozi wena nateekwa kuhondera ebiragiro by'ekitongole.,Omukozi wena nateekwa kuhondera ebiragiro by'ekitongole.,Every employee must follow the company rules.,,,Both,,
Mukozi nyakyaitu,My colleague sits next to me.,Omukozi nyakyaitu aikara haihi nanyowe.,Omukozi nyakyaitu aikara haihi nanyowe.,My colleague sits next to me.,,,Both,,
ebyokwesemeza/ ebyokwesiga,special makeup can change an actors apperance,"ebyokwesiga nibihindura ensisana ya,baaza","ebyokwesiga nibihindura ensisana ya,baaza",special makeup can change an actors apperance,,,Both,,
Enda,The lady at the shop is pregnant.,Mukazi wa haduka ain’enda.,Mukazi wa haduka ain’enda.,The lady at the shop is pregnant.,,,Both,,
by'omuka,Subistence farming is the growing of crops and keeping of animals to help oneself and family.,Abalimi na baliisa abalikukira obwingi balima ebyokurya by'omuka kwonka.,Abalimi na baliisa abalikukira obwingi balima ebyokurya by'omuka kwonka.,Subistence farming is the growing of crops and keeping of animals to help oneself and family.,,,Both,,
orutimbi,the curtain rose and the play began,"orutimbi bakarwi mwkya, omuzaano gwatandika","orutimbi bakarwi mwkya, omuzaano gwatandika",the curtain rose and the play began,,,Both,,
Kukebeza,It’s time for the lady to go for antenatal.,Omukazi ahikize obwire bw’okukebeza.,Omukazi ahikize obwire bw’okukebeza.,It’s time for the lady to go for antenatal.,,,Both,,
sente,The price of the pair of shoes is at twenty thousand only.,Sente zokugura enkaito ziri mitwaro ebiri yonka.,Sente zokugura enkaito ziri mitwaro ebiri yonka.,The price of the pair of shoes is at twenty thousand only.,,,Both,,
Omutaahi,My neighbor is good farmer.,Omutahi wange muliisa murungi.,Omutahi wange muliisa murungi.,My neighbor is good farmer.,,,Both,,
Nyineka,Every saturday I go with my husband to the market to buy food.,Buli kyamukaga ngenda na Nyineka mukatale kugura ebyokurya.,Buli kyamukaga ngenda na Nyineka mukatale kugura ebyokurya.,Every saturday I go with my husband to the market to buy food.,,,Both,,
Abajagara,The Abajagara are a sub clan of Babiito but for them they dont show them to be .,Abajagara kitabu kya Babiito baitu bbo tibeyoleka okuba bbo .,Abajagara kitabu kya Babiito baitu bbo tibeyoleka okuba bbo .,The Abajagara are a sub clan of Babiito but for them they dont show them to be .,,,Both,,
ensimbi,I have enough money to pay for the matress.,Nyina ensimbi ezirukumara kusasaru omufaliso.,Nyina ensimbi ezirukumara kusasaru omufaliso.,I have enough money to pay for the matress.,,,Both,,
Abeka,My family helps each other when the need arises.,Abeeka yange bakonyera ngana obuhabaho okweta.,Abeeka yange bakonyera ngana obuhabaho okweta.,My family helps each other when the need arises.,,,Both,,
timanyire,I dunno where they went.,Timanyire nambere bagenzire.,Timanyire nambere bagenzire.,I dunno where they went.,,,Both,,
Omunyabuzaale,My relative lives in Tooro kingdom.,Omunyabuzaale wange ikara mu Bukama bwa Tooro.,Omunyabuzaale wange ikara mu Bukama bwa Tooro.,My relative lives in Tooro kingdom.,,,Both,,
omuzaani owobutendebeke,stunt double performs dangerous and actions and the actors stay safe,omuzaani owobutendebeke azaana ebicweeka ebisobora kuleeta akabi,omuzaani owobutendebeke azaana ebicweeka ebisobora kuleeta akabi,stunt double performs dangerous and actions and the actors stay safe,,,Both,,
"Owanyinento, Owaisento, Owanyinarumii.",I and my cousin like running every day.,Nyowe nowanyinento nyowe tugonza kwiruka buli kiro.,Nyowe nowanyinento nyowe tugonza kwiruka buli kiro.,I and my cousin like running every day.,,,Both,,
Omwihwa omwojo,My nephew is learning how to ride a bicycle.,Omwihwa wange nayega kusamba egaali.,Omwihwa wange nayega kusamba egaali.,My nephew is learning how to ride a bicycle.,,,Both,,
Kukeehya,Abbreviation,kufunza,,,,,Mixed,N,NAR
