word,definitionEnglish,definitionNative,exampleSentence1,exampleSentence1English,exampleSentence2,exampleSentence2English,dialect,pos,domain
Akagaali,The lame man was given a wheelchair.,Omulema bakamuha akagaali.,Omulema bakamuha akagaali.,The lame man was given a wheelchair.,,,Both,,
Omwigo,It is not easy to use a crutch.,omwigo tigwanguhire kugukozesa.,omwigo tigwanguhire kugukozesa.,It is not easy to use a crutch.,,,Both,,
Ekisanirizo,He bought a prosthetic leg.,Akagura ekisanirizo ky'okuguru.,Akagura ekisanirizo ky'okuguru.,He bought a prosthetic leg.,,,Both,,
Kugarraho,He was taken in for rehabilitation.,Baka mugarraho,Baka mugarraho,He was taken in for rehabilitation.,,,Both,,
Kugonyorra,The old man needs physiotherapy.,Omugurusi nayetaaga Kugonyorra.,Omugurusi nayetaaga Kugonyorra.,The old man needs physiotherapy.,,,Both,,
Obujanjabi bw'omutwe,The boy needs therapy.,Omwojo nayetaaga obujanjabi bw'omutwe.,Omwojo nayetaaga obujanjabi bw'omutwe.,The boy needs therapy.,,,Both,,
Obuzibu,The teacher has an allercy to do with dust.,Omwegesa aine obuzibu necucu.,Omwegesa aine obuzibu necucu.,The teacher has an allercy to do with dust.,,,Both,,
Kutagonza,Her body is alleric to cold water.,Omubirigwe tigugonza amaizi agakufuka.,Omubirigwe tigugonza amaizi agakufuka.,Her body is alleric to cold water.,,,Both,,
Okubaaga,The surgeon prayed before starting the surgical procedure.,Omusaho akabanza yasaba atakandikire kubaaga.,Omusaho akabanza yasaba atakandikire kubaaga.,The surgeon prayed before starting the surgical procedure.,,,Both,,
Enseruliza,His medical condition requires a procedure.,oburwairebwe nibwetaga enseruliza.,oburwairebwe nibwetaga enseruliza.,His medical condition requires a procedure.,,,Both,,
kujanjaba,He was given medication at the hospital.,Bamuhaire obujanjabi hairwarro.,Bamuhaire obujanjabi hairwarro.,He was given medication at the hospital.,,,Both,,
Endagiroo,the prescription is one times three.,Endagiroo negamba kamu emirundi esatu,Endagiroo negamba kamu emirundi esatu,the prescription is one times three.,,,Both,,
akati k'omukono,The lady has an implant.,omkaizi aine akati k'omukono.,omkaizi aine akati k'omukono.,The lady has an implant.,,,Both,,
enfabu,the sheild protect the fighter not be speared,enfabu ekingara omurwani amacumu gata mukwata,enfabu ekingara omurwani amacumu gata mukwata,the sheild protect the fighter not be speared,,,Both,,
ekyesomeko,amori worn all the body to protection the soldier from coming spear,ekyesomeko kijwarwa omubiro gwona nukwokirinde omusiri kale ata hikwaho amacumu,ekyesomeko kijwarwa omubiro gwona nukwokirinde omusiri kale ata hikwaho amacumu,amori worn all the body to protection the soldier from coming spear,,,Both,,
esapeeho,the helmet is worn on the head,esapeeho ejwarwa hamutwe,esapeeho ejwarwa hamutwe,the helmet is worn on the head,,,Both,,
Okusara enseke omubakazi,Sterilization is a permanent birth control method.,Okusara enseke omubakazi nikitangira kimu kuzara.,Okusara enseke omubakazi nikitangira kimu kuzara.,Sterilization is a permanent birth control method.,,,Both,,
okusara enseke omubasaija,vasectomy is rarely an option for men.,okusara enseke omubasaija tikikukanya.,okusara enseke omubasaija tikikukanya.,vasectomy is rarely an option for men.,,,Both,,
Amaizi amecumi,Clean water is good for drinking.,Amaizi amecumi marungi gokunywa.,Amaizi amecumi marungi gokunywa.,Clean water is good for drinking.,,,Both,,
Obwecumi,Good hygiene is really an essential.,Obwecumi kintu kikuru muno.,Obwecumi kintu kikuru muno.,Good hygiene is really an essential.,,,Both,,
Obuyonjo,Poor sanitation causes diseases.,Obuyonjo obubi buleta endwaire.,Obuyonjo obubi buleta endwaire.,Poor sanitation causes diseases.,,,Runyoro,,
Kunaaba engaro,Handwashing before eating helps to prevent cholera.,Kunaaba engaro otakalire kitamba colera.,Kunaaba engaro otakalire kitamba colera.,Handwashing before eating helps to prevent cholera.,,,Both,,
Kusemba,I want to dress my wound.,Ninyenda kusemba ekihoya.,Ninyenda kusemba ekihoya.,I want to dress my wound.,,,Both,,
Akasembo,The wound was small so we covered it with a plaster.,Akahoya kabaire kataito twatekaho akasembo.,Akahoya kabaire kataito twatekaho akasembo.,The wound was small so we covered it with a plaster.,,,Both,,
goozi,use the gauze to cover your wound.,wekonyeze goozi kusemba ekihoya kyawe.,wekonyeze goozi kusemba ekihoya kyawe.,use the gauze to cover your wound.,,,Both,,
Kuhagara,severe Anaphylaxis can lead to death.,Kuhagara kw'omubiri okwamaani nikusobora kuleta kufa.,Kuhagara kw'omubiri okwamaani nikusobora kuleta kufa.,severe Anaphylaxis can lead to death.,,,Both,,
Kaseji,Carthage was an important city in Roman Empire.,Kaseji Rukaba rubuga rukuru muno omu Bukama bwa Roma.,Kaseji Rukaba rubuga rukuru muno omu Bukama bwa Roma.,Carthage was an important city in Roman Empire.,,,Both,,
Fonisiya,Phoenicia civilization of the old in Levant.,Fonisiya kuhweza kwa kara muno omunsi ya levent.,Fonisiya kuhweza kwa kara muno omunsi ya levent.,Phoenicia civilization of the old in Levant.,,,Both,,
Obukama bwa Kusi,Kingdom of Kush was in the South of Egypt.,Obukama bwa Kusi bukaba omumasirimuka ga Misiri.,Obukama bwa Kusi bukaba omumasirimuka ga Misiri.,Kingdom of Kush was in the South of Egypt.,,,Both,,
akizumu,axum first resisted coconialism in africa,akizumu bukama obwabandize kwansirra abalenzi bamamatwara,akizumu bukama obwabandize kwansirra abalenzi bamamatwara,axum first resisted coconialism in africa,,,Both,,
zimbambwe rurangarwa,zimbambwe was a great city long ago,zimbabwe era rwali rubuga rwamaani,zimbabwe era rwali rubuga rwamaani,zimbambwe was a great city long ago,,,Both,,
okuhamba,conquest happens when a strong nation wins the battle and puts it under control.,okuhamba kubaho obu hanga kirimani obulisingura erindi bakarunyaga,okuhamba kubaho obu hanga kirimani obulisingura erindi bakarunyaga,conquest happens when a strong nation wins the battle and puts it under control.,,,Both,,
obutwa,He took poison and died.,Akanywa obutwa yafa.,Akanywa obutwa yafa.,He took poison and died.,,,Both,,
Kufungurwa,Anyone who has taken poison has to be given an antidote.,Omuntu anywire obutwa aine kufungurwa.,Omuntu anywire obutwa aine kufungurwa.,Anyone who has taken poison has to be given an antidote.,,,Both,,
Obujanjambi obukubandizibwaho,An accident victim is always given first aid.,omuntu obwatunga butandu atunga obujanjambi obukubandizibwaho.,omuntu obwatunga butandu atunga obujanjambi obukubandizibwaho.,An accident victim is always given first aid.,,,Both,,
Orupimo,You are supposed to follow the dosage.,osemerire ohondere orupimo.,osemerire ohondere orupimo.,You are supposed to follow the dosage.,,,Both,,
Kurugirwamu,Injections at times have side effects.,enkinzo obumu zigira kurugirwamu.,enkinzo obumu zigira kurugirwamu.,Injections at times have side effects.,,,Both,,
Kugugumuka,My reaction was very scary.,Kugugumuka kwange kukaba kwokutinisa.,Kugugumuka kwange kukaba kwokutinisa.,My reaction was very scary.,,,Both,,
busutama,sword was used in many battles in the past,buzitama ekaruwana amalemu maingi omubiro ebyaura,buzitama ekaruwana amalemu maingi omubiro ebyaura,sword was used in many battles in the past,,,Both,,
icumu,the spear is owned by every head of the family in bunyoro and tooro,icumu kyokurwanisa ekitungwa buli nyineka omunsiya bunyorona tooro,icumu kyokurwanisa ekitungwa buli nyineka omunsiya bunyorona tooro,the spear is owned by every head of the family in bunyoro and tooro,,,Both,,
obuta,bows was the first to shoot far before the guncame inexistance,obutanikyo kyorwanisa ekyabandizi kurasira hara,obutanikyo kyorwanisa ekyabandizi kurasira hara,bows was the first to shoot far before the guncame inexistance,,,Both,,
akasogi,the arrow is used together with the bow,akasogi kakorra ramu nobuta,akasogi kakorra ramu nobuta,the arrow is used together with the bow,,,Both,,
okurwana,The battle between Tanzania and Amin was very threatening.,Okurwana hagati ya Tanzania na Amin kukatiniisa muno.,Okurwana hagati ya Tanzania na Amin kukatiniisa muno.,The battle between Tanzania and Amin was very threatening.,,,Both,,
Kafumura,The Siege engine is used to break through.,Kafumura munda enya kufumura Abagosire.,Kafumura munda enya kufumura Abagosire.,The Siege engine is used to break through.,,,Both,,
obulemu,War is very bad.,Obulemukintu kibi muno.,Obulemukintu kibi muno.,War is very bad.,,,Both,,
Okugota,Siege is when the army surrounds another.,Okugota nubwo Amahe gehunguliriza Agandi.,Okugota nubwo Amahe gehunguliriza Agandi.,Siege is when the army surrounds another.,,,Both,,
Butidda,Catapult is used to hit birds.,Butidda erasa ebinyonyi.,Butidda erasa ebinyonyi.,Catapult is used to hit birds.,,,Both,,
Kacwanyigi,Battering ram is called Kacwamiti,Kacwanyigi kyoma kicwa enyigi.,Kacwanyigi kyoma kicwa enyigi.,Battering ram is called Kacwamiti,,,Both,,
ekigadi,chariot was used to carry weapons and other items to use in the battle,ekigadi rra kyahimbaga ebyokurwanisa nebintu byobulemu,ekigadi rra kyahimbaga ebyokurwanisa nebintu byobulemu,chariot was used to carry weapons and other items to use in the battle,,,Both,,
embarasi,horse was used carry the fighter and itself was trained,embarasi zakosibwaga abarwani kandinazo zakango itendekarwe,embarasi zakosibwaga abarwani kandinazo zakango itendekarwe,horse was used carry the fighter and itself was trained,,,Both,,
Kwonkya,The woman is breastfeeding her baby.,Omukazi nayonkya omwanawe,Omukazi nayonkya omwanawe,The woman is breastfeeding her baby.,,,Both,,
Muto,I met an infact moving alone.,Ntangaine omwana muto narubata wenka.,Ntangaine omwana muto narubata wenka.,I met an infact moving alone.,,,Both,,
Omwana,The children beat their fellow child.,Abaana batiire omwana mugenzi wabo.,Abaana batiire omwana mugenzi wabo.,The children beat their fellow child.,,,Both,,
Ekikoba,He fractured his leg and he was tied with a bandage.,Akacweka okuguru bamutaho ekikoba.,Akacweka okuguru bamutaho ekikoba.,He fractured his leg and he was tied with a bandage.,,,Both,,
okuseesera,"Another country to invade another one like what Russia did to Ukraine, its wrong.",Ihanga okuseera erindi nka Russia okuyasesiire Ukraine kisobere.,Ihanga okuseera erindi nka Russia okuyasesiire Ukraine kisobere.,"Another country to invade another one like what Russia did to Ukraine, its wrong.",,,Both,,
Babironi,"Babylon one time conquered Israel, took them took them to exile for 70 years.",Babironi akasumi kamu ekasengura Isarali yagirema kumara emyaka ensanju.,Babironi akasumi kamu ekasengura Isarali yagirema kumara emyaka ensanju.,"Babylon one time conquered Israel, took them took them to exile for 70 years.",,,Both,,
Asura,Assyria was once a kingdom in Mesopotamia.,Asura nabwo bukabaho obukama omu mesopotaniya.,Asura nabwo bukabaho obukama omu mesopotaniya.,Assyria was once a kingdom in Mesopotamia.,,,Both,,
Peresi,Curo the King of Persia released Israelists from exile to Jerusalem.,Omukama Kuro owa Peresi nuwe yalekiire Abaisaleri bagaruka Yerusalemu.,Omukama Kuro owa Peresi nuwe yalekiire Abaisaleri bagaruka Yerusalemu.,Curo the King of Persia released Israelists from exile to Jerusalem.,,,Both,,
omwiru,Slave was bought or taken as a prisoner of war.,Omwiru bamuguraga rundi bamunyaga.,Omwiru bamuguraga rundi bamunyaga.,Slave was bought or taken as a prisoner of war.,,,Both,,
obwiru,"Slavery was there in the past, in modern times it has faded away.",Obwiru bukaba buroho ira birobinu bukahwaho.,Obwiru bukaba buroho ira birobinu bukahwaho.,"Slavery was there in the past, in modern times it has faded away.",,,Both,,
Abarwanisa mbarasi,Cavalry sit on the horse back and fight.,Abarwanisa mbarasi barwanira hamigongo yembarasi.,Abarwanisa mbarasi barwanira hamigongo yembarasi.,Cavalry sit on the horse back and fight.,,,Both,,
kacweka,"Class is the division among people, others are learned poor and rich class.",Akacweka omubantu akamu kasomere akandi banaku.,Akacweka omubantu akamu kasomere akandi banaku.,"Class is the division among people, others are learned poor and rich class.",,,Both,,
orulengo,Caste is where one is born a noble or a commoner.,Orulengo rwobuzalirwaana oli mwiru rundi muhuma.,Orulengo rwobuzalirwaana oli mwiru rundi muhuma.,Caste is where one is born a noble or a commoner.,,,Both,,
ikama,Feudalism was a lot in France and caused a revolution.,Ikama likaba lingi omunsi ya'France kyarugama abantu kwimukirra gavumenti bagijumika.,Ikama likaba lingi omunsi ya'France kyarugama abantu kwimukirra gavumenti bagijumika.,Feudalism was a lot in France and caused a revolution.,,,Both,,
okusingura,victory brings happiness,okusingura kuleeta okusemererwa kwingi,okusingura kuleeta okusemererwa kwingi,victory brings happiness,,,Both,,
okusingurwa,defeat brings alot of damage,akusubgurwa obulemu kiireta kususukara,akusubgurwa obulemu kiireta kususukara,defeat brings alot of damage,,,Both,,
okuhanika,surrender saves the country getting heavy damage,okuhanika omubulemu kibakirungi thanfa tirisisikara,okuhanika omubulemu kibakirungi thanfa tirisisikara,surrender saves the country getting heavy damage,,,Both,,
endagaano,the treaty between zanzibar and tanganyika brought stability in tanzania,endagaana ug zanzibar na tanganyika bikaleeta okulekaana omu tanzania,endagaana ug zanzibar na tanganyika bikaleeta okulekaana omu tanzania,the treaty between zanzibar and tanganyika brought stability in tanzania,,,Both,,
obuziinge,peace does not come by it self his sought,obusinge tibwereeta kabuserra,obusinge tibwereeta kabuserra,peace does not come by it self his sought,,,Both,,
ekyokurwanisa,the weapon that was trusted in the past was the sword,ekyokurwanisa ira ekibaye sigaganiyo buzitama,ekyokurwanisa ira ekibaye sigaganiyo buzitama,the weapon that was trusted in the past was the sword,,,Both,,
Omurasi,The Archer is trained person to hit the target.,Omurasi wobuta ayegesibwa kuteeba omukiito.,Omurasi wobuta ayegesibwa kuteeba omukiito.,The Archer is trained person to hit the target.,,,Both,,
amahe,The Ugandan army is very strong.,Amahe ga Uganda gaina amaani maingi.,Amahe ga Uganda gaina amaani maingi.,The Ugandan army is very strong.,,,Both,,
Akisiika,Fortification in the Army scares the enemy not to attack easily.,Ekisiika kiri ekimu omumahe ekikonyera okutarumbwa.,Ekisiika kiri ekimu omumahe ekikonyera okutarumbwa.,Fortification in the Army scares the enemy not to attack easily.,,,Both,,
amahe agahamaizi,The navy of Uganda is very professional.,Amahe agahamaizi mu Uganda gagesiibwe kurungi.,Amahe agahamaizi mu Uganda gagesiibwe kurungi.,The navy of Uganda is very professional.,,,Both,,
Ebisisani Rusekesa,He watched aromatic comedy last night.,Omuzaano gw'engonzi mu bisisani Rusekesa.,Omuzaano gw'engonzi mu bisisani Rusekesa.,He watched aromatic comedy last night.,,,Both,,
Ebisisani munyikara zitalizimu,The film's drama moved everyone in tears.,Enyikara y'ebisisani byaharutimbi ebibarozire bikabaliza amaizi.,Enyikara y'ebisisani byaharutimbi ebibarozire bikabaliza amaizi.,The film's drama moved everyone in tears.,,,Both,,
Ebisisani byobujune,The watched a tragedy where a mother killed his son.,Bakarora ebisisani byobujune nambere omukazi yaisire Omwaana we.,Bakarora ebisisani byobujune nambere omukazi yaisire Omwaana we.,The watched a tragedy where a mother killed his son.,,,Both,,
Kujanga,They feel in love in the Romance film.,"Bakatandika kujanga hanyuma, yokurora ebisisani by'engonzi.","Bakatandika kujanga hanyuma, yokurora ebisisani by'engonzi.",They feel in love in the Romance film.,,,Both,,
Ebisisani byemanzi kaswa,Super Heroes fight villains because they cause trouble.,Emanzi kaswa zirwanisa abaleesi bobutabanguko.,Emanzi kaswa zirwanisa abaleesi bobutabanguko.,Super Heroes fight villains because they cause trouble.,,,Both,,
Ebisisani Nyakimerika,A western film tells stories about cow boys life in the old American old west.,Ebisisani Nyakimerika kitwoleka ebya ba komuboi nobwomeezi ebwebirro birimu America.,Ebisisani Nyakimerika kitwoleka ebya ba komuboi nobwomeezi ebwebirro birimu America.,A western film tells stories about cow boys life in the old American old west.,,,Both,,
Obugango,Gunpowder is called obuganga and it is also on match boxes.,Obugango buba bwe mundu kandi buli ha kibiriti.,Obugango buba bwe mundu kandi buli ha kibiriti.,Gunpowder is called obuganga and it is also on match boxes.,,,Both,,
enkungani,Conflict is between the two and its them to resolve it.,Enkungani ziteekwa babiri kandi nubo ba zimaraho.,Enkungani ziteekwa babiri kandi nubo ba zimaraho.,Conflict is between the two and its them to resolve it.,,,Both,,
Rwasamabale,Rwasamabale which is the Cannon was a gun for Kabalega.,Rwasamabale ekaba mundu ya Kabalega.,Rwasamabale ekaba mundu ya Kabalega.,Rwasamabale which is the Cannon was a gun for Kabalega.,,,Both,,
Masiketi,Musket gun was long time ago.,Masiketi mundu yaira muno,Masiketi mundu yaira muno,Musket gun was long time ago.,,,Both,,
Emundu Yomuleera,The Rifle gun was the first to appear in Bunyoro Kitara.,Emundu Yomuleera niyo yabandize kuleetwa Bunyoro Kitara.,Emundu Yomuleera niyo yabandize kuleetwa Bunyoro Kitara.,The Rifle gun was the first to appear in Bunyoro Kitara.,,,Both,,
akalitango,Political campaign cause a lot of conflict.,Akalitango k'ebyendema kaleeta enkunguni nyingi.,Akalitango k'ebyendema kaleeta enkunguni nyingi.,Political campaign cause a lot of conflict.,,,Both,,
obubiito,Nobility is born not acquired.,Obubiito omunru azarwa nabwo tiburuga handi.,Obubiito omunru azarwa nabwo tiburuga handi.,Nobility is born not acquired.,,,Both,,
abaguuda,Aristocracry does not care of commers but for themselves.,Abaguuda tibafaayo abahansi befaaho bonka.,Abaguuda tibafaayo abahansi befaaho bonka.,Aristocracry does not care of commers but for themselves.,,,Both,,
abatesobora,Peasants have small income not enough for their needs.,Abatesobora baina ebintu kyonka tibirukubamara.,Abatesobora baina ebintu kyonka tibirukubamara.,Peasants have small income not enough for their needs.,,,Both,,
abalimi,"Serf have nothing to depend on, survive on working for others.",Abalimi tibagira kantu baikara nibakolereza.,Abalimi tibagira kantu baikara nibakolereza.,"Serf have nothing to depend on, survive on working for others.",,,Both,,
kuteera ebyahaiguru,the director used a crane short to city show the whole city,akakozesa omulingo gwokuteerra haguru nukwo atungeekigisaru kyorubuga rwoona,akakozesa omulingo gwokuteerra haguru nukwo atungeekigisaru kyorubuga rwoona,the director used a crane short to city show the whole city,,,Both,,
kuteerra mumwaanya,the wedding video startsb with a beautiful aerial shot,ubugeruyibwe bukatandika nekisisaru kyomurrwaarya ekirungi kwoleka erukaro kyobugenyi,ubugeruyibwe bukatandika nekisisaru kyomurrwaarya ekirungi kwoleka erukaro kyobugenyi,the wedding video startsb with a beautiful aerial shot,,,Both,,
mporaho kukira kara,slow motion show actions slower than the real life,mporaho kukira kara eyoleka ebirorwo nkorubita bulikiro,mporaho kukira kara eyoleka ebirorwo nkorubita bulikiro,slow motion show actions slower than the real life,,,Both,,
bwango ho kukira kara,fest motion makes things move faster than normal,ayoleka bwangoho kuli nkorubiba bulikiro,ayoleka bwangoho kuli nkorubiba bulikiro,fest motion makes things move faster than normal,,,Both,,
Omuhandiiki w'emizaano ya harutimbi,He is the screenwriter and works with the director.,Omuhandiiki w'emizaano y'orutimbi akoorra hamu nomutekaniza w'ebisisani by'orutimbi.,Omuhandiiki w'emizaano y'orutimbi akoorra hamu nomutekaniza w'ebisisani by'orutimbi.,He is the screenwriter and works with the director.,,,Both,,
rugutiihazabwiire,time lapse shows slow things happening first,amagezi rugutihaza bwiire karwoleka obwire oburaihire,amagezi rugutihaza bwiire karwoleka obwire oburaihire,time lapse shows slow things happening first,,,Both,,
mukama,My Lord the judge.,Mukama wange omucwiwemisango.,Mukama wange omucwiwemisango.,My Lord the judge.,,,Both,,
mugole wange,Lady Tereza will go to Chaina tomorrow.,Mugole wange Tereza nyenkya nagenda Chaina.,Mugole wange Tereza nyenkya nagenda Chaina.,Lady Tereza will go to Chaina tomorrow.,,,Both,,
omunaiti,The knight is a respected person.,Omunaiti aba muntu wekitiniisa omubantu.,Omunaiti aba muntu wekitiniisa omubantu.,The knight is a respected person.,,,Both,,
Ihe kafumba,Infantry are those soldiers on the foot attacking the enemy.,Ihe eriifumba niryo lirubata habigere.,Ihe eriifumba niryo lirubata habigere.,Infantry are those soldiers on the foot attacking the enemy.,,,Both,,
omurwani,A wise warrior does not attack before he studied properly the strength of an enemy.,Omurwani owamagezi tarumba atakamazire kumanya amaani aganyali kuli kuli.,Omurwani owamagezi tarumba atakamazire kumanya amaani aganyali kuli kuli.,A wise warrior does not attack before he studied properly the strength of an enemy.,,,Both,,
omuserukale,A soldier is a member of the army.,Omuserukale nuwe aba murwani mumahe.,Omuserukale nuwe aba murwani mumahe.,A soldier is a member of the army.,,,Both,,
Mucencuzi w'enzooka y'ebisisani Ruganda,"The Director of photography, decides where lights should go.","Omucencuzi W'enzooka y'ebisisani Rugenda, nuwe acwaamu etaara haziragenda","Omucencuzi W'enzooka y'ebisisani Rugenda, nuwe acwaamu etaara haziragenda","The Director of photography, decides where lights should go.",,,Both,,
abatekaniza bebisisani,the director thanked the crew for th e hard work,omwebembezi akasiima abakozi boona habworukora n'amaaru,omwebembezi akasiima abakozi boona habworukora n'amaaru,the director thanked the crew for th e hard work,,,Both,,
abakozi mumuzaano gworutimbi,the film crew includes all people except the actor,abakozi boona a bazaani nibababatarumu,abakozi boona a bazaani nibababatarumu,the film crew includes all people except the actor,,,Both,,
Ebyengonzi Rusekesa,We watched aromatic comedy and grew agoose body.,Tukarora ebisisani by'engonzi rusekesa isoke ryaturuga ha mutwe,Tukarora ebisisani by'engonzi rusekesa isoke ryaturuga ha mutwe,We watched aromatic comedy and grew agoose body.,,,Both,,
kuteera haihi,the director called for a close up of the actor face to capture her tears,omuhabuzi akaragira kuteerra haitu ekisisaru kyahamaiso gomuzaani nurwo akwaate amazigage,omuhabuzi akaragira kuteerra haitu ekisisaru kyahamaiso gomuzaani nurwo akwaate amazigage,the director called for a close up of the actor face to capture her tears,,,Both,,
Ebisisani Nyakarubata,Animation make picture move.,"Ebisisani Nyakarubata, tibiikara mukiikaro kimu.","Ebisisani Nyakarubata, tibiikara mukiikaro kimu.",Animation make picture move.,,,Both,,
kuteerra hagati,the director set kubwa up a medium to shot to capture both actors during their conversation,omuhabuzi akoolera omurwaani omusinauzi obwakabaka naraba muirungu ryomusenyi,omuhabuzi akoolera omurwaani omusinauzi obwakabaka naraba muirungu ryomusenyi,the director set kubwa up a medium to shot to capture both actors during their conversation,,,Both,,
Ekisisani Nyabusorosoro ekigufu.,Children love cartoons because of their bright colors.,"Abaana bagonza ebisisani Nyabusorosoro ebigufu, habwerangi zaabyo ezirukwaaka.","Abaana bagonza ebisisani Nyabusorosoro ebigufu, habwerangi zaabyo ezirukwaaka.",Children love cartoons because of their bright colors.,,,Both,,
kuteerra hagazi,it used a wide shot to capture the wide ste on stage,cosemerule kuteerra hagazi nurwo arwaate entekaniza yona eyaharutti,cosemerule kuteerra hagazi nurwo arwaate entekaniza yona eyaharutti,it used a wide shot to capture the wide ste on stage,,,Both,,
Amagezi gatekinorojo,CGI can create characters that are not real .,Amagezi ga tekinoroje nibakozesa ebintu byokwesisaniriza.,Amagezi ga tekinoroje nibakozesa ebintu byokwesisaniriza.,CGI can create characters that are not real .,,,Both,,
Ebisisani byebyabaireho ira,Young children were interested to watch a film on Historical events.,Abaana abato bakaba nibagonza kurora ebisisani birukukwataho ebyaira.,Abaana abato bakaba nibagonza kurora ebisisani birukukwataho ebyaira.,Young children were interested to watch a film on Historical events.,,,Both,,
Ebisisani byomunyikara eyaira,"The period drama involved Kings, Queens and historical events.","Ebisisani by'omunyikara yaira bikaba birumu, Abakama n'abago, n'ebyabaireho ira.","Ebisisani by'omunyikara yaira bikaba birumu, Abakama n'abago, n'ebyabaireho ira.","The period drama involved Kings, Queens and historical events.",,,Both,,
Ebyobwomeezi,A biopic tells a real person story.,Ebyobwomeezi bwomuntu nibyo yagambireho.,Ebyobwomeezi bwomuntu nibyo yagambireho.,A biopic tells a real person story.,,,Both,,
Ebisisani by'obweemi,Murder is the worst crime.,Obwiisi kikorwa ekiru kukirayo ekyobweemi.,Obwiisi kikorwa ekiru kukirayo ekyobweemi.,Murder is the worst crime.,,,Both,,
Ebyobwemi nabakuru baabyo,Gangster films show the lives of criminal and mob bosses.,"Ebisisani by'obwemi, bitwoleka enkozi zebibi n'abakuru baabo.","Ebisisani by'obwemi, bitwoleka enkozi zebibi n'abakuru baabo.",Gangster films show the lives of criminal and mob bosses.,,,Both,,
Sayansa na Tekinoroje,Science fiction takes the audience to the past and the future.,Sayansa na Tekinoroje munganikyo bitwoleka ebirukwija n'ebyabaireho.,Sayansa na Tekinoroje munganikyo bitwoleka ebirukwija n'ebyabaireho.,Science fiction takes the audience to the past and the future.,,,Both,,
teera kanyarubaju,the camra tilts slowly toreavel the childs face,akateera karyavubaju rukwo ayoleke ekisurumba,akateera karyavubaju rukwo ayoleke ekisurumba,the camra tilts slowly toreavel the childs face,,,Both,,
kuleeta haihiekisisani,the camera zooms in to show the childs face,kamera erateetahaihi ekisisani kwoleka omwana hamarsa,kamera erateetahaihi ekisisani kwoleka omwana hamarsa,the camera zooms in to show the childs face,,,Both,,
